show_id,type,title,director,cast,country,date_added,release_year,rating,duration,listed_in,description
s1538,Movie,Lee Daniels' The Butler,Lee Daniels,"Forest Whitaker, Oprah Winfrey, John Cusack, Jane Fonda, Cuba Gooding Jr., Terrence Howard, Lenny Kravitz, James Marsden, David Oyelowo, Alan Rickman, Liev Schreiber, Robin Williams, Mariah Carey, Alex Pettyfer, Vanessa Redgrave, David Banner, Michael Rainey Jr.",United States,"December 16, 2020",2013,PG-13,132 min,Dramas,The life of a White House butler who worked for eight presidents unfolds against a backdrop of unparalleled change in American history.
s1638,Movie,Don’t Listen,Ángel Gómez Hernández,"Rodolfo Sancho, Ana Fernández, Ramón Barea, Belén Fabra, Lucas Blas",Spain,"November 27, 2020",2020,TV-MA,98 min,"Horror Movies, International Movies","After a tragic turn of events at the new home he's fixing up, Daniel hears a ghostly plea for help, spurring him to seek out a famous paranormal expert."
s5855,Movie,Frank and Cindy,G.J. Echternkamp,,United States,"April 1, 2016",2007,TV-MA,70 min,"Documentaries, Music & Musicals","Frank was a rising pop star when he married Cindy, but decades of dashed dreams and alcoholism have left the pair struggling to find happiness."
s3833,Movie,Dry Martina,Che Sandoval,"Antonella Costa, Patricio Contreras, Geraldine Neary, Pedro Campos, Álvaro Espinosa","Chile, Argentina","May 11, 2019",2018,TV-MA,100 min,"Dramas, Independent Movies, International Movies",An odd encounter with a fan and a tryst with that fan's ex-boyfriend leads a sexually adventurous singer on an escapade in Chile.
s2318,Movie,Total Recall,Paul Verhoeven,"Arnold Schwarzenegger, Rachel Ticotin, Sharon Stone, Michael Ironside, Ronny Cox, Marshall Bell, Michael Champion, Mel Johnson Jr., Roy Brocksmith, Rosemary Dunsmore","United States, Mexico","July 1, 2020",1990,R,114 min,"Action & Adventure, Sci-Fi & Fantasy","After getting a memory implant, working stiff Douglas Quaid discovers he might actually be a secret agent embroiled in a violent insurrection on Mars."
s5177,Movie,Mea Culpa,"Raúl Campos, Jan Suter",Alexis de Anda,Mexico,"November 10, 2017",2017,TV-MA,54 min,Stand-Up Comedy,"Raw and outspoken, comedian Alexis de Anda bares her soul about weddings, exercise, sex, gynecologists, drugs and much more in this stand-up special."
s3988,Movie,Antoine Griezmann: The Making of a Legend,,,,"March 21, 2019",2019,TV-PG,60 min,"Documentaries, International Movies, Sports Movies","With heart and determination, Antoine Griezmann overcame his small stature to become one of the world’s top soccer players and a World Cup champion."
s202,Movie,Kucch To Hai,"Anil V. Kumar, Anurag Basu","Tusshar Kapoor, Esha Deol, Natassha, Vrajesh Hirjee, Kusumit Sana, Rishi Kapoor, Moon Moon Sen, Johny Lever, Ashay Chitre, Jeetendra",India,"August 27, 2021",2003,TV-14,136 min,"Dramas, International Movies, Thrillers","A student tries to steal a test from a teacher's home, leaving him for dead after an accident. A string of murders may be the professor's revenge."
s6542,Movie,CRD,Kranti Kanade,"Mrinmayee Godbole, Vinay Sharma, Saurabh Saraswat, Isha Keskar, Abhay Mahajan, Geetika Tyagi",India,"April 29, 2019",2016,TV-MA,110 min,"Comedies, Dramas, Independent Movies","At odds with his radical instructor's ruthless methods, a drama student assembles his own troupe of misfit actors ahead of a prestigious competition."
s918,Movie,Framing John DeLorean,"Don Argott, Sheena M. Joyce","Alec Baldwin, Josh Charles, Morena Baccarin, Dean Winters, Michael Rispoli, Dana Ashbrook, Jason Jones, Josh Cooke, Sean Cullen, William Hill",United States,"May 5, 2021",2019,TV-MA,109 min,"Documentaries, Dramas","From his rise in the auto industry to his fall from grace, John DeLorean's legacy of power, fast cars and drugs comes to life in this documentary."
s4548,Movie,Monty Python: Live at The Hollywood Bowl,"Terry Hughes, Ian MacNaughton","Graham Chapman, John Cleese, Terry Gilliam, Eric Idle, Terry Jones, Michael Palin, Neil Innes, Carol Cleveland",United Kingdom,"October 2, 2018",1982,R,80 min,Comedies,"Film clips and Terry Gilliam animations feature in this live-to-tape performance of greatest hits, including ""Travel Agent"" and ""Solo Wrestling."""
s7112,Movie,Jack of all Trades,"Harvey Glazer, Stuart Stone",,Canada,"July 16, 2019",2018,TV-MA,86 min,"Documentaries, Sports Movies","Once upon a time, baseball cards were as much an American pastime as the sport. But then scandal rocked the multi-million-dollar industry for good."
s597,Movie,Sword of Trust,Lynn Shelton,"Marc Maron, Jon Bass, Michaela Watkins, Jillian Bell, Toby Huss, Dan Bakkedahl, Lynn Shelton, Whitmer Thomas",United States,"July 1, 2021",2019,R,89 min,"Comedies, Dramas, Independent Movies",An offbeat foursome takes a wild journey through the Southern belt of denial to sell a relic purporting to prove the South won the Civil War.
s2036,Movie,The Social Dilemma,Jeff Orlowski,"Skyler Gisondo, Kara Hayward, Vincent Kartheiser",United States,"September 9, 2020",2020,PG-13,94 min,Documentaries,"This documentary-drama hybrid explores the dangerous human impact of social networking, with tech experts sounding the alarm on their own creations."
s6137,Movie,American Circumcision,Brendon Marotta,,United States,"December 16, 2018",2017,TV-14,101 min,Documentaries,"With interviews from experts on both sides of the debate, this film questions the routine practice of non-religious infant circumcision in the U.S."
s2594,Movie,Thomas & Friends: Marvelous Machinery: A New Arrival,Joey So,"Joseph May, Keith Wickham, Yvonne Grundy, Jules De Jongh, Rachael Louise Miller, Rob Rackstraw, Mike Grady",,"May 1, 2020",2020,TV-Y,23 min,Children & Family Movies,"With a technology fair in Sodor, Thomas and the Steam Team tackle a flurry of tasks — but can they complete their deliveries before the grand opening?"
s209,Movie,Once Upon a Time in Mumbaai,Milan Luthria,"Ajay Devgn, Emraan Hashmi, Kangana Ranaut, Prachi Desai, Randeep Hooda, Naved Aslam, Asif Basra, Avtar Gill",India,"August 27, 2021",2010,TV-14,133 min,"Dramas, International Movies, Music & Musicals","Mumbai's top mob boss rules the underworld with honor and compassion, but his power-hungry protégé will shake up the world of organized crime."
s4062,Movie,Sarvam Thaala Mayam (Tamil Version),Rajiv Menon,"G.V. Prakash Kumar, Nedumudi Venu, Aparna Balamurali, Divyadarshini, Vineeth, Kumaravel, Ravi Prakash, Sumesh",,"March 1, 2019",2018,TV-14,131 min,"Dramas, International Movies, Music & Musicals","An aspiring musician battles age-old caste divides to be able to learn the art of a classical instrument from a traditionalist, veteran percussionist."
s3798,Movie,Joy,Sudabeh Mortezai,"Anwulika Alphonsus, Mariam Precious Sanusi, Angela Ekeleme",Austria,"May 24, 2019",2019,TV-MA,101 min,"Dramas, Independent Movies, International Movies","Close to paying off her debts, a Nigerian sex worker in Austria coaches a reluctant novice, and assesses the risks of taking a faster path to freedom."
s8325,Movie,The Good Neighbor,Kasra Farahani,"James Caan, Logan Miller, Keir Gilchrist, Laura Innes, Edwin Hodge, Anne Dudek, Bailey Noble, Lili Reinhart, Mindy Sterling",United States,"December 5, 2016",2016,TV-MA,97 min,"Dramas, Independent Movies, Thrillers","Two tech-savvy teens plot to fool a cranky old neighbor into believing his house is haunted, but their cruel prank soon takes some unexpected turns."
s2751,Movie,A truthful Mother,Ravishankar Venkateswaran,"Revathi, Roger Narayanan, Sneha Ravishankar, Vidya Shankar, SR Leela",India,"March 31, 2020",2020,TV-Y7,85 min,Children & Family Movies,"Facing a drought, a hungry tiger and a noble cow have an extraordinary encounter in this fable based on a children’s book and a Kannada folk song."
s620,Movie,Deranged,Jameel Buari,"Nadia Buari, Ramsey Nouah, Zynnell Zuh, Priscilla Opoku Agyeman, Jason E.L Agha, Lisbeth Lopez Acquah, Henry Prempeh, Pascaline Edwards, Prince Mingle, Kelvin Boateng",,"June 30, 2021",2020,TV-14,98 min,"Dramas, International Movies",A substitute teacher and an obsessive student begin an illicit affair that endangers everyone involved and blurs the line between predator and prey.
s1788,Movie,Metallica Through The Never,Nimród Antal,"Dane DeHaan, James Hetfield, Lars Ulrich, Kirk Hammett, Robert Trujillo",United States,"October 28, 2020",2013,R,93 min,Music & Musicals,"As heavy metal band Metallica tears up the stage, a young roadie is sent on an urgent errand. But his mission soon takes a surreal turn."
s5646,Movie,Marvel's Hulk: Where Monsters Dwell,Mitch Schauer,"Fred Tatasciore, Liam O'Brien, Jesse Burch, Edward Bosco, Chiara Zanni, Mike Vaughn, Jon Olson, Matthew Waterson, Zach Callison, Laura Bailey, Hope Levy",United States,"January 4, 2017",2016,PG,75 min,"Children & Family Movies, Sci-Fi & Fantasy","On Halloween, the Hulk and Dr. Strange battle monsters wreaking havoc on New York and uncover an evil plot by Nightmare, ruler of the Dream Dimension."
s7039,Movie,I Am Maris,Laura VanZee Taylor,Maris Degener,United States,"April 1, 2019",2018,TV-14,54 min,Documentaries,"Through her own words and art, a young woman details the healing power of yoga in her struggle with anorexia and her journey to self-acceptance."
s4588,Movie,Muran,Rajan Madhav,"Prasanna, Cheran, Haripriya, Nikhita, Suma Bhattacharya, Jayaprakash",India,"October 1, 2018",2011,TV-14,134 min,"Action & Adventure, International Movies","When jingle composer Nanda's car breaks down on his way to Chennai, he hitchhikes there with Arjun, who tries to rope Nanda into a shady deal."
s6625,Movie,Don Quixote: The Ingenious Gentleman of La Mancha,"Mahin Ibrahim, Austin Kolodney, Will Lowell, David Beier, Dave Dorsey, Xu Zhang, Alana Waksman, Jon YonKondy, Drue Metz, Brandon Somerhalder","Carmen Argenziano, Horatio Sanz, Luis Guzman, Vera Cherny, Lorena McGregor, Reinaldo Zavarce, Jacquie Barnbrook, Anthony Skordi, Lin Shaye, James Franco",United States,"January 5, 2018",2015,TV-14,83 min,"Comedies, Independent Movies","In this modern adaptation of a Spanish classic, an eccentric, elderly gentleman sets out with his honest sidekick to right the wrongs of the world."
s3487,Movie,Malaal,Mangesh Hadawale,"Meezaan Jaffrey, Sharmin Segal, Chinmaya Surve, Anil Gawas, Sonal Jha, Sanjay Gurbaxani, Sameer Dharmadhikari, Deepak Damle",India,"September 26, 2019",2019,TV-14,133 min,"Dramas, International Movies, Romantic Movies","Class divides become thorns in the budding romance between the crony of a nativist Mumbai politician and the new, North Indian resident of his chawl."
s5967,Movie,15-Aug,Swapnaneel Jayakar,"Rahul Pethe, Mrunmayee Deshpande, Adinath Kothare, Vaibhav Mangale, Jaywant Wadkar, Satish Pulekar, Naina Apte, Uday Tikekar",India,"March 29, 2019",2019,TV-14,124 min,"Comedies, Dramas, Independent Movies","On India's Independence Day, a zany mishap in a Mumbai chawl disrupts a young love story while compelling the residents to unite in aid of a little boy."
s7703,Movie,Papa the Great,Bhagyaraj,"Krishan Kumar, Nagma, Satya Prakash, Master Bobby, Satish Kaushik, Laxmikant Berde, Mahavir Shah, Anil Dhawan, Shama Deshpande, Shatrughan Sinha",India,"December 8, 2017",2000,TV-PG,137 min,"Comedies, Dramas, International Movies","After witnessing a murder, a meek family man must summon his courage when he finds himself on the wrong side of a notorious gangster."
s686,Movie,Fatherhood,Paul Weitz,"Kevin Hart, Alfre Woodard, Lil Rel Howery, DeWanda Wise, Frankie Faison, Anthony Carrigan, Paul Reiser, Melody Hurd",United States,"June 18, 2021",2021,PG-13,111 min,Dramas,"A widowed new dad copes with doubts, fears, heartache and dirty diapers as he sets out to raise his daughter on his own. Inspired by a true story."
s7837,Movie,Reaction,Husam El-Gohari,"Mahmoud Abdel Moghny, Amr Youssef, Horeya Farghaly, Mahmoud El Gendy, Entessar, Donia El Masry, Sabry Abdel Moniem, Raouf Mustafa, Alaa Zenhom",Egypt,"June 20, 2019",2011,TV-14,99 min,"Dramas, International Movies","When a series of seemingly random people are murdered, baffled police search for a killer who may have a connection to them all."
s8150,Movie,Tamanchey,Navneet Behal,"Nikhil Dwivedi, Richa Chadha, Damandeep Singh Baggan, Vijay Pande, Talib Mehdi, Tushar Phulke, Mahesh Gupta, Prasad Labhe",India,"October 15, 2017",2014,TV-MA,111 min,"Action & Adventure, International Movies, Romantic Movies",A man and a woman on the run from the law are drawn to each other through the common bond of their mutual dependency.
s2311,Movie,David Foster: Off the Record,Barry Avrich,David Foster,Canada,"July 1, 2020",2019,TV-MA,107 min,"Documentaries, Music & Musicals","From child prodigy to iconic music producer, David Foster shares the stories behind his success with rare footage and interviews with his collaborators."
s7543,Movie,My Little Pony Equestria Girls: Rainbow Rocks,"Jayson Thiessen, Ishi Rudell","Tara Strong, Ashleigh Ball, Andrea Libman, Tabitha St. Germain, Cathy Weseluck, Rebecca Shoichet, Maryke Hendrikse, Kazumi Evans, Diana Kaarina","United States, Canada","December 17, 2014",2014,TV-Y,73 min,"Children & Family Movies, Comedies","Rainbow Dash, Applejack, Pinkie Pie, Rarity and Fluttershy plan to perform with their new band at the Canterlot High musical showcase."
s4741,Movie,Invisible,Pablo Giorgelli,"Mora Arenillas, Mara Bestelli, Diego Cremonesi","Argentina, France","August 1, 2018",2017,TV-MA,87 min,"Dramas, Independent Movies, International Movies","After learning she's pregnant, a teen grapples with the consequences while trying to go about her life as if nothing has changed."
s2593,Movie,The Heartbreak Kid,"Bobby Farrelly, Peter Farrelly","Ben Stiller, Michelle Monaghan, Jerry Stiller, Malin Akerman, Stephanie Courtney, Rob Corddry, Carlos Mencia, Ali Hillis, Danny McBride, Scott Wilson",United States,"May 1, 2020",2007,R,116 min,"Comedies, Romantic Movies","Ben Stiller stars as a newlywed who marries a dreamy woman, only to learn on their honeymoon that she's a total nightmare."
s1611,Movie,Angels & Demons,Ron Howard,"Tom Hanks, Ewan McGregor, Ayelet Zurer, Stellan Skarsgård, Pierfrancesco Favino, Nikolaj Lie Kaas, Armin Mueller-Stahl, Thure Lindhardt, David Pasquesi, Cosimo Fusco","United States, Italy","December 1, 2020",2009,PG-13,139 min,Thrillers,A Harvard symbologist races to uncover clues that will help stop an attack on the Vatican by a secret society looking to retaliate for old persecutions.
s6046,Movie,A Mission in an Old Movie,Ahmad El-Badri,"Edward, Fifi Abdo, Lotfy Labib, Madeleine Matar, Nahla Zaki, Ahmed Fathy, Said Tarabeek, Badriya Tolba, Eman El-Sayed",,"April 25, 2019",2012,TV-MA,98 min,"Comedies, International Movies",A young man struggles with his overbearing mother while looking for romance and a way to kick-start his show business career.
s6559,Movie,Dancing Quietly,Philipp Eichholtz,"Martina Schöne-Radunski, Hans-Heinrich Hardt, Sebastian Fräsdorf, Claudia Jacob, Deleila Piasko, Tobias Borchers, Ruth Bickelhaupt",Germany,"April 1, 2017",2016,TV-MA,70 min,"Dramas, Independent Movies, International Movies","After years of battling a deep depression, a young woman attempts to pass an important exam with the help of a fellow student."
s1585,Movie,Ava,Tate Taylor,"Jessica Chastain, Colin Farrell, John Malkovich, Common, Geena Davis, Jess Weixler, Diana Silvers, Joan Chen, Ioan Gruffudd",United States,"December 7, 2020",2020,R,97 min,"Action & Adventure, Dramas",An elite assassin wrestling with doubts about her work scrambles to protect herself — and her estranged family — after a hit goes dangerously wrong.
s4493,Movie,Gnome Alone,Peter Lepeniotis,"Becky G., Josh Peck, Tara Strong, Olivia Holt, David Koechner, Jeff Dunham, Patrick Stump, Nash Grier, Madison De La Garza, George Lopez","United Kingdom, Canada, United States, Cayman Islands","October 19, 2018",2018,PG,86 min,"Children & Family Movies, Comedies","After moving into a new house with her mom, high schooler Chloe discovers a troupe of talking garden gnomes who need her help saving the world."
s6360,Movie,Boom,Kaizad Gustad,"Amitabh Bachchan, Gulshan Grover, Jackie Shroff, Javed Jaffrey, Katrina Kaif, Madhu Sapre, Padma Lakshmi, Seema Biswas, Zeenat Aman, Boman Irani",India,"March 1, 2018",2003,TV-MA,79 min,"Action & Adventure, Dramas, International Movies","Following a fashion show mishap, three supermodels find themselves on the run from dangerous gangsters trying to recover a fortune in stolen diamonds."
s5734,Movie,Norman Lear: Just Another Version of You,"Heidi Ewing, Rachel Grady","Norman Lear, George Clooney, Bill Moyers, John Amos, Russell Simmons, Louise Lasser, Rob Reiner, Jon Stewart, Amy Poehler",United States,"November 1, 2016",2016,TV-MA,91 min,Documentaries,"This documentary turns the spotlight on the man behind the iconic ""All in the Family,"" with comments from friends, family and famous collaborators."
s2724,Movie,Friendship,Raj Khosla,"Amitabh Bachchan, Shatrughan Sinha, Zeenat Aman, Prem Chopra, Amrish Puri, Helen, Pran, Gajanan Jagirdar, Sajjan, Iftekhar",India,"April 1, 2020",1980,TV-14,161 min,"Action & Adventure, Dramas, International Movies","Best friends since childhood, a righteous cop and a lawyer who represents criminals in court become rivals when they fall for the same woman."
s944,Movie,Never Back Down,Jeff Wadlow,"Sean Faris, Amber Heard, Cam Gigandet, Evan Peters, Leslie Hope, Djimon Hounsou, Wyatt Smith, Affion Crockett, Neil Brown Jr., Lauren Leech, Tilky Jones, Steven Crowley, Tom Nowicki",United States,"May 1, 2021",2008,PG-13,113 min,"Action & Adventure, Dramas, Sports Movies","When a quick-tempered teen moves to a new town and faces the challenges of attending a new high school, he seeks solace in an underground fight club."
s3406,Movie,Seventeen,Daniel Sánchez Arévalo,"Biel Montoro, Nacho Sánchez, Lola Cordón, Itsaso Arana, Chani Martín, Iñigo Aranburu, Kandido Uranga, Javier Cifrián, Mamen Duch, Carolina Clemente, Jorge Cabrera, Daniel Fuster, Edgar Costas, Patxi Santamaría",Spain,"October 18, 2019",2019,TV-MA,100 min,"Comedies, Dramas, International Movies","To find his therapy dog, a 17-year-old escapes from juvie and embarks on a journey of reconnection with his brother and grandmother through Cantabria."
s7602,Movie,NOVA: Building Chernobyl's MegaTomb,Martin Gorst,Eric Meyers,United States,"July 1, 2019",2017,TV-PG,53 min,Documentaries,"Thirty years after Chernobyl’s nuclear disaster, engineers race against time to complete a new dome to contain the reactor’s lethal radiation."
s4784,Movie,The Skin of the Wolf,Samu Fuentes,"Mario Casas, Irene Escolar, Ruth Díaz",Spain,"July 6, 2018",2018,TV-MA,110 min,"Dramas, Independent Movies, International Movies",An animal trapper living in an abandoned mountain town in northern Spain seeks to resolve his loneliness by securing a wife.
s452,Movie,Twilight,Catherine Hardwicke,"Kristen Stewart, Robert Pattinson, Billy Burke, Peter Facinelli, Elizabeth Reaser, Cam Gigandet, Ashley Greene, Anna Kendrick, Nikki Reed, Taylor Lautner, Jackson Rathbone, Kellan Lutz",United States,"July 16, 2021",2008,PG-13,122 min,"Action & Adventure, Dramas, Romantic Movies","When Bella Swan moves in with her father, she starts school and meets Edward, a mysterious classmate who reveals himself to be a 108-year-old vampire."
s232,Movie,The Water Man,David Oyelowo,"David Oyelowo, Rosario Dawson, Lonnie Chavis, Amiah Miller, Alfred Molina, Maria Bello",United States,"August 25, 2021",2021,PG,92 min,"Children & Family Movies, Dramas","Desperate to save his ailing mother, 11-year-old Gunner runs away from home on a quest to find a mythic figure rumored to have the power to cheat death."
s4727,Movie,Highway,Imtiaz Ali,"Randeep Hooda, Alia Bhatt, Durgesh Kumar, Pradeep Nagar",India,"August 2, 2018",2014,TV-14,127 min,"Action & Adventure, Dramas, International Movies","City girl Veera is kidnapped on the eve of her wedding, but as her captors take her through the countryside, Veera finds herself feeling emancipated."
s8280,Movie,The Diabolical,Alistair Legrand,"Ali Larter, Arjun Gupta, Max Rose, Merrin Dungey, Chloe Perrin, Kurt Carley, Patrick Fischler, Wilmer Calderon, Tom Wright",United States,"August 1, 2018",2015,TV-MA,86 min,"Horror Movies, Sci-Fi & Fantasy, Thrillers","Terrorized by unexplained disturbances and horrific visions in her home, a young widowed mother turns to her scientist boyfriend for help."
s1982,Movie,Whipped,Chandra Liow,"Andovi da Lopez, Jovial da Lopez, Chandra Liow, Tommy Limmm, Susan Sameh, Widika Sidmore, Kezia Aletheia, Karina Salim",Indonesia,"September 18, 2020",2020,TV-14,98 min,"Comedies, International Movies, Romantic Movies",Four buddies attend a class taught by a love guru who leads them to question their romantic attachments — until her hidden agenda comes to light.
s7869,Movie,Righteous Kill,Jon Avnet,"Robert De Niro, Al Pacino, 50 Cent, Carla Gugino, John Leguizamo, Donnie Wahlberg, Brian Dennehy, Trilby Glover",United States,"June 1, 2019",2008,R,101 min,"Dramas, Thrillers","Two detectives investigate a rash of vigilante killings linked to an old case, suggesting they might have put an innocent man behind bars."
s7136,Movie,John & Jane,Ashim Ahluwalia,,India,"August 15, 2016",2005,TV-14,79 min,"Documentaries, International Movies",Truth and fiction blend in this quasi-documentary about six exhausted workers at a Mumbai call center servicing U.S. customers.
s5993,Movie,16 Blocks,Richard Donner,"Bruce Willis, Mos Def, David Morse, Jenna Stern, Cylk Cozart, Casey Sander, David Zayas, Robert Racki, Patrick Garrow, Sasha Roiz","United States, Germany","November 1, 2019",2006,PG-13,102 min,Action & Adventure,"Tasked with escorting a prosecution witness to court, an aging cop gears up for the 16-block trek – but they'll be lucky to make it there alive."
s8678,Movie,Vikings Unearthed,Harvey Lilley,Eric Meyers,United States,"March 1, 2017",2016,TV-PG,113 min,Documentaries,Archaeologist Sarah Parcak follows clues to early Viking explorations and discusses just what these notoriously fierce warriors were really like.
s4789,Movie,Katt Williams: Kattpacalypse,Marcus Raboy,Katt Williams,United States,"July 3, 2018",2012,TV-MA,61 min,Stand-Up Comedy,"Urban comic Katt Williams ushers in Kattpacalypse, exploding with more energy than an atomic bomb and riffing on everything from Doomsday to Obama."
s2702,Movie,The Last Airbender,M. Night Shyamalan,"Noah Ringer, Dev Patel, Nicola Peltz, Jackson Rathbone, Shaun Toub, Aasif Mandvi, Cliff Curtis, Seychelle Gabriel, Jessica Andres, Keong Sim, Summer Bishil, Francis Guinan, Katharine Houghton, Damon Gupton",United States,"April 8, 2020",2010,PG,104 min,"Action & Adventure, Children & Family Movies, Sci-Fi & Fantasy","In a world ravaged by the Fire nation's aggression toward the peaceful Air, Water and Earth nations, a young boy holds the key to restoring peace."
s2991,Movie,Die Ontwaking,Johnny Breedt,"Gys de Villiers, Juanita de Villiers, Gérard Rudolf, Paul Eilers, Pete Spyropoulos, Jaco Muller, Armand Aucamp, Christine Tesco",South Africa,"January 24, 2020",2015,TV-MA,90 min,"International Movies, Thrillers",An inexperienced murder detective joins a desperate search for a deranged serial killer who possesses a deep obsession with young women’s skin.
s652,Movie,Osuofia in London,Kingsley Ogoro,"Nkem Owoh, Mara Derwent, Francis Odega, Cynthia Okereke, Tom Njemanze, Romanus Amuta, Sabina Mole, Blessing Onolleka, Oluchi Agunwa, Chiwendu Onaga, Patricia Ezeani, Stephen Ahanonu",Nigeria,"June 22, 2021",2003,TV-MA,84 min,"Comedies, Dramas, International Movies","A villager in Nigeria becomes the sole beneficiary of his late brother's estate in England, which, according to custom, includes his brother's fiancée."
s4756,Movie,Parmanu: The Story of Pokhran,Abhishek Sharma,"John Abraham, Boman Irani, Diana Penty, Anuja Sathe, Yogendra Tikku, Aditya Hitkari, Vikas Kumar, Ajay Shankar, Darshan Pandya, Mark Benington",India,"July 25, 2018",2018,TV-PG,124 min,"Dramas, International Movies","A dedicated government official puts his career in jeopardy by insisting that India become a nuclear power, a goal that powerful forces resist."
s490,Movie,Back to Q82,Ahmed Siddiqui,"Jassim Al Nabhan, Abdel Imam Abdullah, Abdulaziz El Nassar, Khalid Muthafar, Amal Anbari, Ali Al-Hamdaan, El Hussein Abd, Nawaf Al Shemmeri, Bashar Abd Alah, Naser Albouloshy","Kuwait, United States","July 8, 2021",2017,TV-14,104 min,"Comedies, International Movies","Eager to rejoin her divorced parents, an inventor's daughter drives his time-traveling car back to 1982. But a secret crush accidentally follows."
s5208,Movie,1922,Zak Hilditch,"Thomas Jane, Molly Parker, Dylan Schmid, Kaitlyn Bernard, Bob Frazer, Brian d'Arcy James, Neal McDonough",United States,"October 20, 2017",2017,TV-MA,103 min,"Dramas, Thrillers","A farmer pens a confession admitting to his wife's murder, but her death is just the beginning of a macabre tale. Based on Stephen King's novella."
s4294,Movie,Springsteen on Broadway,Thom Zimny,Bruce Springsteen,United States,"December 16, 2018",2018,TV-MA,153 min,Music & Musicals,Bruce Springsteen shares personal stories from his life and acoustic versions of some of his best-known songs in an intimate one-man show.
s6713,Movie,Every Time I Die,Robi Michael,"Drew Fonteiro, Marc Menchaca, Michelle Macedo, Tyler Fleming, Melissa Macedo, Kenneth Moronta, Frankie Hinton",United States,"February 25, 2020",2019,TV-MA,98 min,"Dramas, Independent Movies, Thrillers","After a paramedic’s violent death during a weekend trip, his spirit inhabits his friends’ bodies in an effort to save them from a similar fate."
