show_id,type,title,director,cast,country,date_added,release_year,rating,duration,listed_in,description
s8015,Movie,Sicilian Ghost Story,"Fabio Grassadonia, Antonio Piazza","Julia Jedlikowska, Gaetano Fernandez, Corinne Musallari, Lorenzo Curcio, Andrea Falzone, Federico Finocchiaro, Vincenzo Amato, Sabine Timoteo","Italy, France, Switzerland","July 6, 2019",2017,TV-MA,119 min,"Dramas, International Movies, Thrillers","When officials are slow to investigate a mysterious disappearance, a teen girl searches the dark woods on the outskirts of town for the boy she loves."
s2470,Movie,Ne Zha,Yu Yang,"Lü Yanting, Joseph, Han Mo, Chen Hao, Lü Qi, Zhang Jiaming, Yang Wei",China,"May 25, 2020",2019,TV-14,110 min,"Action & Adventure, Comedies, International Movies","Bound by a divine mandate, rebellious outcast Ne Zha grapples with his formidable powers and a destiny that would imperil his loved ones."
s3236,Movie,Shot Caller,Ric Roman Waugh,"Nikolaj Coster-Waldau, Omari Hardwick, Lake Bell, Jon Bernthal, Emory Cohen, Jeffrey Donovan, Evan Jones, Benjamin Bratt, Holt McCallany",United States,"November 24, 2019",2017,R,121 min,"Dramas, Thrillers","Trying to go straight, a once-successful businessman fresh out of prison is forced to orchestrate a brazen crime or risk his family."
s8598,Movie,To Be a Miss,"Edward Ellis, Flor Salcedo, Aaron Woolf",,"United States, Venezuela","January 1, 2017",2016,TV-14,84 min,Documentaries,Explore how the media and nationalism have fueled Venezuela's passion for physical appearance and the multibillion-dollar beauty pageant industry.
s1514,Movie,Atlas Shrugged: Part II,John Putch,"Samantha Mathis, Jason Beghe, Esai Morales, Patrick Fabian, Kim Rhodes, Richard T. Jones, D.B. Sweeney, Paul McCrane, John Rubinstein, Robert Picardo",United States,"December 19, 2020",2012,PG-13,112 min,Dramas,"With the world's economy in dire straits, corporate protagonist Dagny Taggart searches for a solution amid the rubble of a long-abandoned factory."
s7400,Movie,Mansfield Park,Patricia Rozema,"Frances O'Connor, Embeth Davidtz, Jonny Lee Miller, Alessandro Nivola, Harold Pinter, Lindsay Duncan, Sheila Gish, James Purefoy, Victoria Hamilton, Hugh Bonneville",United Kingdom,"January 1, 2020",1999,PG-13,112 min,"Comedies, Dramas, International Movies","A poor heroine is sent to live with wealthy relatives in 1800s England, where her wit and writing talent find the room, and circumstance, to grow."
s1335,Movie,Monster Run,Henri Wong,"Shawn Yue, Jessie Li, Kara Wai, Tu Men, Qiao Shan, Wang Yutian, Yang Di, Wang Zhener",China,"February 7, 2021",2020,TV-14,104 min,"Action & Adventure, International Movies","Jimo, an outcast who can see monsters, teams up with a monster hunter to fight evil forces and soon discovers her greater calling."
s6092,Movie,Adore,Anne Fontaine,"Naomi Watts, Robin Wright, Xavier Samuel, James Frecheville, Ben Mendelsohn, Jessica Tovey, Sophie Lowe, Gary Sweet, Alyson Standen, Skye Sutherland, Sarah Henderson","Australia, France","November 20, 2019",2013,R,111 min,"Dramas, Independent Movies, International Movies","When lifelong friends Roz and Lil fall in love with each other's teenage sons, they must carry out their affairs in relative secrecy."
s6398,Movie,Cabin Fever,Travis Zariwny,"Gage Golightly, Matthew Daddario, Samuel Davis, Nadine Crocker, Dustin Ingram, Randy Schulman",United States,"June 6, 2019",2016,R,98 min,"Horror Movies, Thrillers","As a flesh-eating virus rips its way through a remote woodland cabin, the terrified teens vacationing inside wonder who'll fall victim next."
s2287,Movie,Pyaar Ka Punchnama 2,Luv Ranjan,"Kartik Aaryan, Nushrat Bharucha, Sonalli Sehgall, Sunny Singh, Ishita Raj, Omkar Kapoor, Sharat Saxena, Mona Ambegaonkar",India,"July 5, 2020",2015,TV-MA,136 min,"Comedies, Dramas, International Movies",Three young bachelors find the reality of relationships to be far removed from the idea of true romance that they had once pursued.
s6637,Movie,Doubles Cause Troubles,Wong Jing,"Carol 'Do Do' Cheng, Maggie Cheung, Wilson Lam, Chan Pak-cheung, Charlie Cho, Tom Poon, Kwan Ming-yuk, Hon Yee-Sang, Sherman Wong, Lo Fan",Hong Kong,"August 1, 2018",1989,TV-14,94 min,"Action & Adventure, Comedies, International Movies","When the tenant in their flat dies under suspicious circumstances, two bickering cousins are forced to navigate both sides of the law."
s4599,Movie,Pizza,Akshay Akkineni,"Akshay Oberoi, Parvathy Omanakuttan, Arunoday Singh, Dipannita Sharma, Rajesh Sharma, Omkar Das Manikpuri, Hussain Dalal, D. Santosh",India,"October 1, 2018",2014,TV-14,102 min,"Horror Movies, International Movies, Thrillers",A pizza delivery boy who doesn't believe in the supernatural is forced to confront his convictions after being trapped in a house on his route.
s2303,Movie,Thiago Ventura: POKAS,"Fabio Ock, Joana Mazzucchelli",Thiago Ventura,Brazil,"July 2, 2020",2020,TV-MA,82 min,Stand-Up Comedy,"In a rollicking special, Thiago Ventura jokes about life in the hood, social issues and more, explaining how actions speak louder than words."
s5087,Movie,Tom Segura: Disgraceful,Jay Karas,Tom Segura,United States,"January 12, 2018",2018,TV-MA,71 min,Stand-Up Comedy,"Tom Segura gives voice to the sordid thoughts you'd never say out loud, with blunt musings on porn, parking lot power struggles, parenthood and more."
s1089,Movie,Thunder Force,Ben Falcone,"Melissa McCarthy, Octavia Spencer, Jason Bateman, Bobby Cannavale, Pom Klementieff, Melissa Leo, Taylor Mosby, Marcella Lowery, Melissa Ponzio",United States,"April 9, 2021",2021,PG-13,107 min,"Action & Adventure, Comedies",Two childhood best friends reunite as an unlikely crime-fighting superhero duo when one invents a formula that gives ordinary people superpowers.
s338,Movie,Good Luck Chuck,Mark Helfrich,"Dane Cook, Jessica Alba, Dan Fogler, Ellia English, Sasha Pieterse, Annie Wood, Lonny Ross, Chelan Simmons, Simone Bailly, Jodelle Ferland, Crystal Lowe, Troy Gentile, Georgia Craig, Michelle Harrison, Chiara Zanni","United States, Canada","August 1, 2021",2007,R,99 min,"Comedies, Romantic Movies","Every time Chuck breaks up with a girlfriend, she ends up engaged to her next boyfriend. Soon, women are dating Chuck in hopes of meeting Mr. Right."
s5618,Movie,Happy New Year,Farah Khan,"Shah Rukh Khan, Deepika Padukone, Abhishek Bachchan, Sonu Sood, Boman Irani, Vivaan Shah",India,"February 1, 2017",2014,TV-14,179 min,"Action & Adventure, Comedies, Dramas",A revenge-seeking diamond thief gathers a ragtag crew to infiltrate a Dubai hotel hosting a dance contest. But first they have to learn how to dance.
s5768,Movie,Harud,Aamir Bashir,"Mohammad Amir Naji, Shahnawaz Bhat, Shamim Basharat, Salma Ashai, Mudessir Ahmed Khan, Rayes Mohiuddin",India,"October 1, 2016",2010,TV-MA,100 min,"Dramas, International Movies","A young Kashmiri man sets out to escape to Pakistan and make sense of his brother's death, but he drifts aimlessly until finding his brother's camera."
s462,Movie,The Unknown Saint,Alaa Eddine Aljem,"Younes Bouab, Salah Bensalah, Bouchaib Essamak, Mohamed Naimane, Anas Elbaz, Hassan Ben Badida, Abdelghani Kitab, Ahmed Yarziz, Rachid El Adouani, Mohamed El Moutamassik, Abdel Ghani Benizza, Adam Morjany",,"July 15, 2021",2019,TV-14,100 min,"Comedies, Dramas, Independent Movies","Following a stint behind bars, a thief returns to where he buried his loot, only to find that his hiding spot is now a shrine to an unknown saint."
s1365,Movie,Zathura,Jon Favreau,"Jonah Bobo, Josh Hutcherson, Dax Shepard, Kristen Stewart, Tim Robbins, Frank Oz, John Alexander, Derek Mears, Douglas Tait, Joe Bucaro III",United States,"February 1, 2021",2005,PG,101 min,"Children & Family Movies, Sci-Fi & Fantasy","A mysterious game sends two brothers flying into space, where they must reach the planet Zathura — or be trapped in galactic limbo forever."
s8571,Movie,Theater of Life,Peter Svatek,Massimo Bottura,Canada,"July 18, 2017",2016,TV-PG,94 min,Documentaries,This documentary follows chef Massimo Bottura as he opens a soup kitchen to cook gourmet meals for the needy from food waste at the 2015 Milan Expo.
s1330,Movie,The Misadventures of Hedi and Cokeman,Julien Royal,"Hedi Bouchenafa, Nassim Lyes, Fred Testot, Julie Ferrier, Benjamin Tranié, Hugues Jourdain, Charlotte Gabris, Vincent Desagnat, Nina Kepekian, Hakim Jemili, Bun-hay Mean",France,"February 10, 2021",2021,TV-MA,99 min,"Comedies, International Movies","In Paris, two dysfunctional dealers use family ties to try to boost their small drug business in this crass comedy based on the webseries."
s2237,Movie,Little Singham: Legend of Dugabakka,,,,"July 15, 2020",2020,TV-Y7,68 min,"Children & Family Movies, Comedies","As fears rise over a ghost known for nighttime abductions, Mirchi Nagar residents look to the only person they know can save them: Little Singham!"
s4607,Movie,The Birth Reborn,Eduardo Chauvet,,,"October 1, 2018",2018,TV-MA,91 min,"Documentaries, International Movies","Featuring experts in their fields and raw and moving footage, this documentary makes a case for increased autonomy in women's choices for childbirth."
s3734,Movie,Adam Devine: Best Time of Our Lives,Jay Karas,Adam Devine,United States,"June 18, 2019",2019,TV-MA,59 min,Stand-Up Comedy,"Frenetic comic Adam Devine talks teen awkwardness, celebrity encounters, his ""Pitch Perfect"" audition and more in a special from his hometown of Omaha."
s4211,Movie,Komola Rocket,Noor Imran Mithu,"Tauquir Ahmed, Mosharraf Karim, Joyraj, Samia Said, Dominic Gomez",Bangladesh,"January 7, 2019",2018,TV-14,95 min,"Dramas, Independent Movies, International Movies","As the lives of rich and poor passengers aboard a steamship unfold, buried secrets, lustful affairs and selfish desires are exposed."
s6866,Movie,Golden Time,Takuya Inaba,,Japan,"November 1, 2017",2013,TV-Y,22 min,"International Movies, Sci-Fi & Fantasy","In the 1980s, a recently discarded television set from the 1960s refuses to accept its fate and tries to break out of the junkyard."
s6500,Movie,Clive Davis: The Soundtrack of Our Lives,Chris Perkel,Clive Davis,United States,"September 17, 2019",2017,TV-MA,124 min,"Documentaries, Music & Musicals",This music-driven documentary charts Clive Davis' 50-year career as one of the world's most influential record moguls.
s2373,Movie,One Take,Manatsanun Phanlerdwongsakul,BNK48,Thailand,"June 18, 2020",2020,TV-G,86 min,"Documentaries, International Movies, Music & Musicals",Members of Thai girl group BNK48 share the ups and downs of preparing for the 6th Single Senbatsu General Election.
s6354,Movie,Bokeh,"Geoffrey Orthwein, Andrew Sullivan","Maika Monroe, Matt O'Leary, Arnar Jónsson, Gunnar Helgason, Berglind Rós Sigurðardóttir","United States, Iceland","June 22, 2017",2017,TV-14,92 min,"Dramas, Independent Movies, Sci-Fi & Fantasy","After learning they are the sole survivors of an eerie apocalypse, a young American couple on vacation in Iceland ponder their love and the future."
s6236,Movie,Barbie in A Mermaid Tale,Adam Wood,"Kelly Sheridan, Kathleen Barr, Tabitha St. Germain, Peter Mel, Nakia Burrise, Maryke Hendrikse, Emma Pierson, Ciara Janson, Garry Chalk, Nicole Oliver",United States,"October 1, 2017",2010,TV-Y,74 min,Children & Family Movies,"Surf champ Merliah discovers she's actually a mermaid in a girl's body. With the help of a dolphin, Merliah must rescue her mom, the Queen of Oceana."
s4525,Movie,Tales From the Hood 2,"Rusty Cundieff, Darin Scott","Keith David, Bryan Batt, Alexandria Deberry, Bill Martin Williams, Martin Bats Bradford, Kendrick Cross, Jasmine Akakpo, Kedrick Brown",United States,"October 10, 2018",2018,R,110 min,"Cult Movies, Horror Movies, Independent Movies",Buckle up for an anthology of socially conscious horror stories that focus on the perils of racial injustice and the price of ignorance.
s8642,Movie,Turbo,David Soren,"Ben Schwartz, Bill Hader, Luis Guzmán, Snoop Dogg, Paul Giamatti, Ryan Reynolds, Maya Rudolph, Ken Jeong, Samuel L. Jackson, Michael Peña, Michelle Rodriguez, Richard Jenkins, Kurtwood Smith, Luis Guzman",United States,"September 12, 2019",2013,PG,96 min,"Children & Family Movies, Comedies",A speed-obsessed snail who dreams of being the world's greatest race car driver gets his chance when an accident imbues him with high-octane speed.
s2882,Movie,Taxi Driver,Daniel Oriahi,"Odunlade Adekola, Ijeoma Grace Agu, Richard Akinlade, Babajide Alimison, Hafeez Oyetoro, Femi Jacobs, Toyin Oshinaike, Kelechi Udegbe",Nigeria,"February 26, 2020",2015,TV-MA,94 min,"Comedies, Dramas, Independent Movies","After his father dies, a young mechanic moves to the city to drive the old man’s taxi, and encounters assassins and a motley crew of urban weirdos."
s2200,Movie,The Speed Cubers,Sue Kim,,United States,"July 29, 2020",2020,TV-PG,41 min,Documentaries,This documentary captures the extraordinary twists and turns in the journeys of Rubik's Cube-solving champions Max Park and Feliks Zemdegs.
s257,Movie,Nneka The Pretty Serpent,Tosin Igho,"Idia Aisien, Ndidi Obi, Kenneth Okolie, Zack Orji, Bovi Ugboma, Bimbo Ademoye, Beverly Osu, Beverly Naya, Larry Gaaga, Shaffy Bello, Chioma Chukwuka Akpotha, Waje",,"August 18, 2021",2020,TV-14,140 min,"Dramas, International Movies","Years after the mysterious murder of her parents, a traumatized woman gains supernatural powers that aid in her quest for revenge against the killers."
s1736,Movie,One More Try,Ruel S. Bayani,"Angel Locsin, Angelica Panganiban, Dingdong Dantes, Zanjoe Marudo, Miguel Vergara, Gina Pareño, Carmina Villarroel, Agot Isidro",Philippines,"November 5, 2020",2012,TV-14,102 min,"Dramas, International Movies, Romantic Movies","When her son's condition becomes severe, a woman reconnects with the biological father. But the reunion puts a strain on their respective relationships."
s7173,Movie,Katt Williams: Live,Alphonso J. Wesson,Katt Williams,United States,"July 19, 2018",2006,NR,85 min,Stand-Up Comedy,"Outspoken comedian Katt Williams pokes fun at a variety of topics, including sex, relationships, parenthood and trying to make it as an entertainer."
s7165,Movie,Kahlil Gibran's The Prophet,"Roger Allers, Gaëtan Brizzi, Paul Brizzi, Joan C. Gratz, Mohammed Saeed Harib, Tomm Moore, Nina Paley, Bill Plympton, Joann Sfar, Michael Socha","Liam Neeson, Salma Hayek, John Krasinski, Frank Langella, Alfred Molina, John Rhys-Davies, Quvenzhané Wallis","United States, France, Canada, Lebanon, Qatar","October 1, 2017",2014,PG,85 min,"Children & Family Movies, Dramas",A troubled young girl and her mother find solace on a journey with a subversive poet whose words captivate their hearts and imaginations.
s4737,Movie,Thank You,Anees Bazmee,"Akshay Kumar, Bobby Deol, Sonam Kapoor, Irrfan Khan, Sunil Shetty, Rimi Sen, Celina Jaitly",India,"August 2, 2018",2011,TV-14,131 min,"Comedies, International Movies, Romantic Movies",Three cheating husbands end up paying the price for their infidelities when their spouses hire a private detective – who falls for one of the wives.
s7789,Movie,Power Rangers: Megaforce: The Robo Knight Before Christmas,James Barr,"Andrew M. Gray, Ciara Hanna, John Mark Loudermilk, Christina Masterson, Azim Rizk, Shailesh Prajapati, Ian Harcourt",United States,"January 1, 2016",2013,TV-Y7,24 min,Children & Family Movies,Robo Knight learns the meaning of Christmas from a group of children when he is mistaken for a donated Christmas toy and is shipped to a foreign land.
s8790,Movie,You Changed My Life,Cathy Garcia-Molina,"John Lloyd Cruz, Sarah Geronimo, Rayver Cruz, Dante Rivero, Rowell Santiago, Al Tantay, Irma Adlawan, Bernard Palanca, Matet De Leon, Joross Gamboa",Philippines,"February 27, 2019",2009,TV-PG,116 min,"Comedies, Dramas, International Movies","Laida and Miggy think they've found perfect happiness with each other, until their burgeoning careers force them into a long-distance relationship."
s5682,Movie,Mariah Carey's Merriest Christmas,James Yukich,"Mariah Carey, Lacey Chabert, Kelsey Grammer, Billy Gardell, Fina Strazza, Kenneth Edmonds, Cameron Mathison, Brennan Elliott",United States,"December 9, 2016",2015,TV-G,38 min,"Children & Family Movies, Music & Musicals","Pop music superstar Mariah Carey hosts this all-star holiday celebration with special guests and a celebrity reading of ""The Night Before Christmas."""
s5470,Movie,Rangoon,Vishal Bhardwaj,"Saif Ali Khan, Shahid Kapoor, Kangana Ranaut, Shriswara, Richard McCabe, Satoru Kawaguchi, Surendra Pal, Lin Laishram",India,"May 29, 2017",2017,TV-14,153 min,"Action & Adventure, Dramas, International Movies","During World War II, daredevil star Miss Julia entertains soldiers at the Indo-Burma border, where she's caught up in a web of love and deceit."
s5931,Movie,Mission Blue,"Robert Nixon, Fisher Stevens","James Cameron, Michael deGruy, Sylvia Earle, Bryce Groark, Jeremy Jackson, Carl Safina","United States, Bermuda, Ecuador","August 15, 2014",2014,TV-PG,94 min,Documentaries,This documentary follows oceanographer Sylvia Earle's campaign to save the world's oceans from threats such as overfishing and toxic waste.
s8082,Movie,Star Men,Alison E. Rose,,"Canada, United States, United Kingdom","February 5, 2017",2015,TV-14,88 min,Documentaries,Four astronomers from England celebrate 50 years of friendship and achievement by taking a reflective road trip through the American Southwest.
s4063,Movie,The Boy Who Harnessed the Wind,Chiwetel Ejiofor,"Maxwell Simba, Chiwetel Ejiofor, Aïssa Maïga, Lily Banda, Lemogang Tsipa, Philbert Falakeza, Joseph Marcell, Noma Dumezweni","United Kingdom, Malawi","March 1, 2019",2019,TV-PG,114 min,"Children & Family Movies, Dramas, Independent Movies","Inspired by a science book, 13-year-old William Kamkwamba builds a wind turbine to save his Malawian village from famine. Based on a true story."
s5661,Movie,Gabriel lglesias: I’m Sorry For What I Said When I Was Hungry,Manny Rodriguez,Gabriel Iglesias,United States,"December 20, 2016",2016,TV-14,88 min,Stand-Up Comedy,"Hawaiian-shirt enthusiast Gabriel ""Fluffy"" Iglesias finds the laughs in racist gift baskets, Prius-driving cops and all-female taco trucks."
s8167,Movie,Terminator 3: Rise of the Machines,Jonathan Mostow,"Arnold Schwarzenegger, Nick Stahl, Claire Danes, Kristanna Loken, David Andrews, Mark Famiglietti, Earl Boen, Moira Sinise, Chopper Bernet, Christopher Lawford","United States, Germany, United Kingdom","January 1, 2020",2003,R,109 min,"Action & Adventure, Sci-Fi & Fantasy","Ten years after John Connor saved Earth from Judgment Day, he encounters T-X, a robotic assassin ordered to finish what T-1000 started."
s8706,Movie,We Need to Talk,David Serrano,"Hugo Silva, Michelle Jenner, Ernesto Sevilla, Belén Cuesta, Óscar Ladoire, Ilay Kurelovic, Verónica Forqué, Luis Jaspe, Borja Luna, José Luis Marín",Spain,"September 1, 2016",2016,TV-MA,91 min,"Comedies, International Movies, Romantic Movies","A happy woman's new love is going great, but she needs one thing: divorce papers from her depressed ex. To get them, trickery may be in order."
s2283,Movie,One by Two,Devika Bhagat,"Abhay Deol, Preeti Desai, Lillete Dubey, Rati Agnihotri, Jayant Kripalani, Darshan Jariwala, Anish Trivedi, Geetika Tyagi, Preetika Chawla, Tahir Raj Bhasin",India,"July 5, 2020",2014,TV-14,135 min,"Comedies, Dramas, International Movies",The lives of a Mumbai man and woman who are both dealing with issues intersect through a TV dance show that she wants to win but he wants to sabotage.
s7418,Movie,Mary Poppins Returns,Rob Marshall,"Emily Blunt, Lin-Manuel Miranda, Ben Whishaw, Emily Mortimer, Pixie Davies, Nathanael Saleh, Joel Dawson, Julie Walters, Meryl Streep, Colin Firth, Dick Van Dyke","United States, United Kingdom","July 9, 2019",2018,PG,131 min,"Children & Family Movies, Music & Musicals","In 1930s London, Michael Banks and his three children get some help turning their topsy-turvy world around when his magical childhood nanny reappears."
s5799,Movie,Jandino: Whatever it Takes,,Jandino Asporaat,United Kingdom,"September 9, 2016",2016,TV-MA,94 min,Stand-Up Comedy,"Jandino Asporaat riffs on the challenges of raising kids and serenades the audience with a rousing rendition of ""Sex on Fire"" in his comedy show."
s742,Movie,Blind Intersections,Lara Saba,"Alaa Hammoud, Ghida Nouri, Carole Hajj, Chadi Haddad, Leila Hakim, Charbel Ziade, Nibal Arakji, Caroline Hatem, Josyane Boulos, Mario Bassil","Lebanon, United Arab Emirates","June 10, 2021",2012,TV-MA,91 min,"Dramas, International Movies",This film follows the societal challenges three strangers in Beirut go through as unexpected events link their fates.
s785,Movie,Cloudburst,Thom Fitzgerald,"Olympia Dukakis, Ryan Doucette, Brenda Fricker, Kristin Booth, Michael McPhee, John Dunsworth, Jeremy Akerman, Mary-Colin Chisholm, Kevin Kincaid","United States, Canada","June 2, 2021",2011,TV-MA,93 min,"Comedies, Dramas, Independent Movies","A lesbian couple escapes from their nursing home and heads to Canada to get married. Along the way, they pick up a young male hitchhiker."
s3198,Movie,Mahi NRI,Gaurav Bavdankar,"Harrdy Sandhu, Poppy Jabbal, Rameet Kaur, B.N. Sharma, Navneet Nishan, Gurpreet Guggi, Anjum Batra, Ranjan Sehgal",United Kingdom,"December 1, 2019",2017,TV-14,134 min,"Comedies, Dramas, International Movies","A Punjabi man attempts to build a life in London in hopes of impressing his girlfriend’s mother, who insists her daughter marry a man outside of India."
s8471,Movie,The Push,"Grant Korgan, Brian Niles",Grant Korgan,United States,"June 7, 2019",2018,TV-MA,90 min,"Documentaries, Sports Movies","After a snowmobile accident paralyzed him, Grant Korgan became the first athlete with a spinal cord injury to push himself to the South Pole."
s1470,Movie,What's Eating Gilbert Grape,Lasse Hallström,"Johnny Depp, Leonardo DiCaprio, Juliette Lewis, Mary Steenburgen, Darlene Cates, Laura Harrington, Mary Kate Schellhardt, Kevin Tighe, John C. Reilly, Crispin Glover",United States,"January 1, 2021",1993,PG-13,118 min,"Classic Movies, Dramas, Independent Movies","In a backwater Iowa town, young Gilbert is torn between taking care of his troubled family and a girl who shows him new possibilities for his life."
s3875,Movie,Sur Sapata,Mangesh Kanthale,"Upendra Limaye, Govind Namdeo, Sanjay Jadhav, Anand Ingale, Bharat Ganeshpure, Praveen Tarde, Chinmay Patwardhan, Jivan Karlakar",India,"May 1, 2019",2019,TV-14,140 min,"Comedies, Dramas, International Movies",A group of small-town students goes for glory by competing in a statewide kabaddi tournament 25 years after their school's championship victory.
s2164,Movie,Anelka: Misunderstood,Franck Nataf,Nicolas Anelka,France,"August 5, 2020",2020,TV-14,95 min,"Documentaries, International Movies, Sports Movies","Inscrutable, incomparable or both? Famed French footballer Nicolas Anelka’s controversial legacy is explored in this in-depth documentary."
s405,Movie,9to5: The Story of a Movement,,,,"July 22, 2021",2021,TV-MA,85 min,Documentaries,"In this documentary, female office workers in '70s Boston inspire change with a call for better pay, more opportunities and an end to sexual harassment."
s7876,Movie,Road to Yesterday,Ishaya Bako,"Genevieve Nnaji, Oris Erhuero, Majid Michel",Nigeria,"July 1, 2016",2015,TV-14,96 min,"Dramas, International Movies","Their marriage failing, Victoria and Izu try to reconnect during a road trip. But bringing long-repressed secrets to light threatens yet more discord."
s593,Movie,She's Out of My League,Jim Field Smith,"Jay Baruchel, Alice Eve, T.J. Miller, Mike Vogel, Nate Torrence, Krysten Ritter, Geoff Stults, Lindsay Sloane, Andrew Daly, Jasika Nicole, Kyle Bornheimer",United States,"July 1, 2021",2010,R,106 min,"Comedies, Romantic Movies","Kirk's a 5. His new girlfriend Molly's a 10. No one knows what she sees in him, including Kirk. Will his raging insecurities ruin this budding romance?"
s2110,Movie,John Was Trying to Contact Aliens,,,United States,"August 20, 2020",2020,TV-PG,17 min,"Documentaries, LGBTQ Movies","A rural electronics whiz broadcasts radio signals into space and monitors for signs of aliens, but makes a more important connection here on Earth."
s5624,Movie,Semana Santa,Alejandra Márquez Abella,"Tenoch Huerta, Anajosé Aldrete, Esteban Ávila, David Thornton, Jimena Cuarón, Lakshmi Picazo",Mexico,"January 31, 2017",2015,TV-MA,87 min,"Dramas, International Movies","A single mother, her boyfriend and her 8-year-old son take a weeklong resort vacation, during which secrets and relationship strains take their toll."
s4178,Movie,IO,Jonathan Helpert,"Margaret Qualley, Anthony Mackie, Danny Huston",United States,"January 18, 2019",2019,TV-14,96 min,"Dramas, Sci-Fi & Fantasy","As a young scientist searches for a way to save a dying Earth, she finds a connection with a man who's racing to catch the last shuttle off the planet."
s596,Movie,Stuart Little,Rob Minkoff,"Michael J. Fox, Jonathan Lipnicki, Geena Davis, Hugh Laurie, Nathan Lane","Germany, United States","July 1, 2021",1999,PG,85 min,"Children & Family Movies, Comedies","When his parents adopt a mouse instead of a little boy, George realizes brothers come in all shapes and sizes. But Snowbell the cat is not so welcoming."
s3447,Movie,Noblemen,Vandana Kataria,"Ali Haji, Kunal Kapoor, Muskkaan Jaferi, Hardik Thakkar, Ali Mir, Shaan Grover, M.K. Raina, Ivan Rodrigues",India,"October 5, 2019",2019,TV-MA,109 min,"Dramas, Independent Movies, International Movies","When he lands the lead in his Christian school's production of ""The Merchant of Venice,"" a secretly gay student is bullied by wealthy upperclassmen."
