show_id,type,title,director,cast,country,date_added,release_year,rating,duration,listed_in,description
s505,TV Show,The War Next-door,,"Vanessa Bauche, Ana Layevska, Mark Tacher, Pascacio López, Elyfer Torres, Armando Said, Christian Vazquez, Marco León, Loreto Peralta, Isabella Patrón, Sara Isabel Quintero, Cecilia de los Santos Vargas",,"July 7, 2021",2021,TV-MA,1 Season,"International TV Shows, Spanish-Language TV Shows, TV Comedies","When two antagonistic families end up living next door in a posh neighborhood, the matriarchs ensue a full-scale war of unintended consequences."
s1548,TV Show,Teen Mom 2,,"Jenelle Evans, Chelsea Houska, Kailyn Lowry, Leah Messer",United States,"December 15, 2020",2011,TV-14,2 Seasons,Reality TV,"The highs and lows of new parenting and adulting create drama and heartbreak as life moves on for the cast of ""16 and Pregnant"" Season 2."
s6604,TV Show,Dexter,,"Michael C. Hall, Jennifer Carpenter, David Zayas, James Remar, C.S. Lee, Lauren Vélez, Desmond Harrington, Julie Benz, Christina Robinson, Geoff Pierson",United States," January 1, 2018",2013,TV-MA,8 Seasons,"Crime TV Shows, TV Dramas, TV Mysteries","By day, mild-mannered Dexter is a blood-spatter analyst for the Miami police. But at night, he is a serial killer who only targets other murderers."
s7761,TV Show,Power Battle Watch Car,,"Sang-hyun Um, Tae-yeol Jeon, Yeong-wung Jeong, Hye-won Jeong, Yong-woo Shin, Jin-hong Bae, Do-hyeong Nam, Min-kyu Lee",,"June 1, 2017",2016,TV-Y7,1 Season,"Kids' TV, Korean TV Shows","Jino and his Watch Car, Bluewill, compete in the Battle League to become world champions. Meanwhile, a dark force threatens to destroy them all."
s3554,TV Show,True and the Rainbow Kingdom,,"Michela Luci, Jamie Watson, Anna Claire Bartlam, Dante Zee, Eric Peterson","United States, Canada","August 30, 2019",2019,TV-Y,3 Seasons,Kids' TV,"When something's wrong in the Rainbow Kingdom, bighearted guardian True and her best friend, Bartleby, are there to grant wishes and save the day."
s5233,TV Show,Kibaoh Klashers,,"Ben Diskin, Cherami Leigh, Dakota Basseri, Keith Silverstein, Johnny Yong Bosch, Lucien Dodge, Jamie Simone, Nicolas Roye, Robbie Daymond, Michael Sorich",China,"October 6, 2017",2017,TV-Y7,2 Seasons,Kids' TV,"Young beetle Dylan and his friends Hailey and Ollie team up to compete against tough opponents in the exciting, high-octane sport of Battle Blading."
s4360,TV Show,Spy Kids: Mission Critical,,"Ashley Bornancin, Carter Hastings, Caitlyn Bairstow, Nicholas Coombe, Nesta Cooper, Richard Ian Cox, Tom Kenny, Travis Turner, Candi Milo, Mira Sorvino","United States, Canada","November 30, 2018",2018,TV-Y7,2 Seasons,Kids' TV,"In this animated spinoff series, Juni and Carmen Cortez must battle the evil organization S.W.A.M.P. – without the help of their super-spy parents."
s5090,TV Show,Tundukkan Playboy Itu,,"Hafidz Roshdi, Uqasha Senrose, Alif Satar, Mawar Rashid",,"January 8, 2018",2016,TV-PG,1 Season,"International TV Shows, Romantic TV Shows, TV Comedies","Under pressure from his parents to settle down, a pleasure-seeking playboy falls for a woman who's like nobody he's ever met."
s3645,TV Show,Beat Bugs,,"Ashleigh Ball, Lili Beaudoin, Charles Demers, Rebecca Husain, Erin Mathews","Australia, Canada","July 21, 2019",2018,TV-Y,3 Seasons,Kids' TV,"With songs made famous by the Beatles, five friendly bugs learn big lessons about the world around them – all from the safety of their own backyard."
s4080,TV Show,Unsolved,,"Josh Duhamel, Jimmi Simpson, Bokeem Woodbine",United States,"February 27, 2019",2018,TV-MA,1 Season,"Crime TV Shows, TV Dramas",Ride along for a dramatized version of the real-life investigations into the murders of rap icons Tupac Shakur and Biggie Smalls.
s2954,TV Show,Team Kaylie,,"Bryana Salaz, Alison Fernandez, Symera Jackson, Elie Samouhi, Kai Calhoun, Eliza Pryor, Rosa Blasi, Nicole Sullivan, David Gridley",United States,"February 3, 2020",2020,TV-PG,3 Seasons,"Kids' TV, TV Comedies","After a brush with the law, teen celebrity Kaylie Konrad swaps social stardom for court-ordered chaos as a middle school wilderness club leader."
s1357,TV Show,My Dead Ex,,"Katherine Hughes, Ryan Lee, Ryan Malaty, Medalion Rahimi, Marc Evan Jackson, Beth Littleford, Audrey Wasilewski, Matt Braunger",United States,"February 1, 2021",2018,TV-14,1 Season,"TV Comedies, Teen TV Shows",High school teens Charley and Ben find themselves in a complicated romance when Ben dies in a tragic accident but is resurrected by a magical spell.
s762,TV Show,Human: The World Within,,,,"June 4, 2021",2021,TV-PG,1 Season,"Docuseries, Science & Nature TV",Cutting-edge science and captivating personal stories collide in this illuminating docuseries about the incredible workings of the human body.
s84,TV Show,Metal Shop Masters,,Jo Koy,,"September 10, 2021",2021,TV-MA,1 Season,Reality TV,"On this competition show, a group of metal artists torch, cut and weld epic, badass creations from hardened steel. Only one will win a $50,000 prize."
s5302,TV Show,LEGO Elves: Secrets of Elvendale,,"Ashleigh Ball, Erin Mathews, Rebecca Husain, Kyle Rideout, Riley Murdock, Vincent Tong, Nicole Oliver, Scott McNeil, Kathleen Barr",United States,"September 1, 2017",2017,TV-Y7,1 Season,Kids' TV,"Armed with a powerful amulet, a teenage guardian is tasked with protecting her little sister – and all of Elvendale. Based on the popular web series."
s752,TV Show,Guru Aur Bhole,,Amit Kumar,,"June 8, 2021",2018,TV-Y7,2 Seasons,"Kids' TV, TV Comedies",A singer and a dancer who are best friends use their artistic abilities to get out of one hilariously sticky situation after another.
s2644,TV Show,Love 101,,"Pınar Deniz, Kubilay Aka, Mert Yazıcıoğlu, Alina Boz, Selahattin Paşalı, İpek Filiz Yazıcı, Kaan Urgancıoğlu, Müfit Kayacan, Bade İşçil, Tuba Ünsal",Turkey,"April 24, 2020",2020,TV-MA,1 Season,"International TV Shows, TV Dramas, Teen TV Shows","While trying to make their teacher fall for a basketball coach, four misfits and a model student find friendship, love and the courage to be themselves."
s2252,TV Show,The Twelve,Wouter Bouvijn,"Maaike Neuville, Charlotte De Bruyne, Tom Vermeir, Mieke De Groote, Johan Heldenbergh, Zouzou Ben Chikha, Peter Gorissen, Piet De Praitere, Maaike Cafmeyer, Josse De Pauw, Greet Verstraete, Koen De Sutter, Isabelle Van Hecke, Lynn Van Royen",Belgium,"July 10, 2020",2019,TV-MA,1 Season,"Crime TV Shows, International TV Shows, TV Dramas",Twelve jurors — ordinary people with struggles of their own — must decide the case of a woman accused of killing her best friend and her own daughter.
s3559,TV Show,Million Pound Menu,,,United Kingdom,"August 27, 2019",2019,TV-MA,2 Seasons,"British TV Shows, International TV Shows, Reality TV",Next-gen restaurateurs get the chance to open their own pop-up eateries to impress the paying public – and a panel of discerning U.K. investors.
s5175,TV Show,Glitter Force Doki Doki,Go Koga,"Debi Derryberry, Cassandra Morris, Melissa Fahn, Stephanie Sheh, Erica Lindbeck, Kate Higgins, Cherami Leigh, Tara Sands, Bryce Papenbrook, Erica Mendez, Ray Chase, Carrie Keranen, Ben Diskin, Grant George, Kirk Thornton",Japan,"November 10, 2017",2017,TV-Y7,2 Seasons,"Anime Series, Kids' TV",Four girls summon their inner superheroes to defend Earth and the magical kingdom of Splendorius from King Mercenare and his minions.
s6679,TV Show,El Vato,,"El Dasa, Cristina Rodlo, Ricardo Polanco, Gustavo Egelhaaf, Mauricio Martínez, Itatí Cantoral, Arcelia Ramírez, Horacio Castelo, Fátima Molina, Leonardo Daniel, Giancarlo Vidrio, Mónica Dionne, Sebastián Ferrat, Mauricio Isaac, Aldo Gallardo, Julio Casado, Arnulfo Reyes Sanchez, José María de Tavira, Pablo Bracho, Patricio Sebastián",United States," February 24, 2018",2017,TV-MA,2 Seasons,"International TV Shows, Spanish-Language TV Shows, TV Comedies","Regional Mexican singer El Vato and his friends struggle to succeed in the enticing but deceptive music world in Los Angeles, California."
s219,TV Show,Titletown High,,,,"August 27, 2021",2021,TV-14,1 Season,"Reality TV, Teen TV Shows","In a Georgia town where football rules and winning is paramount, a high school team tackles romance, rivalries and real life while vying for a title."
s679,TV Show,The Assassination of Gianni Versace,,"Edgar Ramírez, Darren Criss, Ricky Martin, Penélope Cruz",United States,"June 19, 2021",2018,TV-MA,1 Season,"Crime TV Shows, TV Dramas, TV Thrillers","Defining moments in Andrew Cunanan's life, starting in childhood, lead up to a 1997 murder spree that kills five, including fashion icon Gianni Versace."
s8786,TV Show,YOM,,"Sairaj, Devyani Dagaonkar, Ketan Singh, Mayur Vyas, Ketan Kava",,"June 7, 2018",2016,TV-Y7,1 Season,Kids' TV,"With the mind of a human being, and the body of whichever animal he chooses to be, a young boy protects the world from danger."
s5145,TV Show,Oggy and the Cockroaches,Olivier Jean-Marie,"Don Michael Paul, Tony Sampson, Sam Vincent, Matt Hill, Greg Eagles, Peter Kelamis, Tara Strong, Rick Jones",France,"December 1, 2017",2017,TV-Y7,1 Season,"Kids' TV, TV Comedies","Wimpy blue cat Oggy would like nothing more than to snooze, but he's constantly bothered by the three ugly cockroaches who have invaded his home."
s7548,TV Show,My Tattoo Addiction,,Julian Barratt,United Kingdom,"February 1, 2019",2013,TV-MA,1 Season,"British TV Shows, Docuseries",Ink junkies dig skin deep and share personal stories about their collection of body art.
s5113,TV Show,72 Dangerous Animals: Latin America,,Bob Brisbane,"Australia, United States","December 22, 2017",2017,TV-14,1 Season,"Docuseries, International TV Shows, Science & Nature TV","Powerful cats, indestructible arachnids and flesh-melting pit vipers are just the beginning in this series about Latin America's deadliest creatures."
s1573,TV Show,The Big Show Show,,"Paul Wight, Allison Munn, Reylynn Caster, Lily Brooks O'Briant, Juliet Donenfeld",United States,"December 9, 2020",2020,TV-G,2 Seasons,"Kids' TV, TV Comedies",Former WWE wrestler the Big Show is out of the ring and ready for an even tougher challenge: raising three daughters with his wife in Florida.
s3246,TV Show,Singapore Social,,"Nicole Ong, Mae Tan, Sukki Singapora, Vinny Sharp, Paul Foster, Tabitha Nauser","Singapore, United States","November 22, 2019",2019,TV-MA,1 Season,"International TV Shows, Reality TV","Peer into the lives of young Singaporeans as they defy expectations and traverse the tricky terrain of career, romance and family."
s7339,TV Show,Los 10 años de Peter Capusotto,,"Diego Capusotto, Ivana Acosta",,"June 29, 2018",2015,TV-MA,1 Season,"International TV Shows, Spanish-Language TV Shows, TV Comedies",Fictional personality Peter Capusotto parodies Argentine culture and rock music in a series of humorous sketches with recurring characters.
s8175,TV Show,That '70s Show,,"Topher Grace, Mila Kunis, Ashton Kutcher, Danny Masterson, Laura Prepon, Wilmer Valderrama, Debra Jo Rupp, Kurtwood Smith, Don Stark, Tanya Roberts, Tommy Chong, Lisa Robin Kelly",United States," November 1, 2017",2005,TV-14,8 Seasons,TV Comedies,"Feel groovy in 1970s suburbia, where a teen and his pals hang in the basement, listening to rock and indulging other hazy benefits of '70s culture."
s3686,TV Show,Stranger Things,,"Winona Ryder, David Harbour, Finn Wolfhard, Millie Bobby Brown, Gaten Matarazzo, Caleb McLaughlin, Natalia Dyer, Charlie Heaton, Cara Buono, Noah Schnapp, Matthew Modine, Joe Keery, Dacre Montgomery, Sadie Sink, Paul Reiser, Sean Astin",United States,"July 4, 2019",2019,TV-14,3 Seasons,"TV Horror, TV Mysteries, TV Sci-Fi & Fantasy","When a young boy vanishes, a small town uncovers a mystery involving secret experiments, terrifying supernatural forces and one strange little girl."
s8110,TV Show,Strongland,,,,"January 18, 2019",2018,TV-PG,1 Season,"Docuseries, International TV Shows","From Spain's countryside to Scotland's stony terrain, this collection of uplifting documentaries explores the cultural roots of great strongman traditions."
s1949,TV Show,Van Helsing,,"Kelly Overton, Jonathan Scarfe, Christopher Heyerdahl, Paul Johansson, David Cubitt, Tim Guinee",United States,"September 27, 2020",2019,TV-MA,4 Seasons,"International TV Shows, TV Action & Adventure, TV Dramas","After three years in a coma, Vanessa awakens to a world ravaged by vampires. Now, she and a motley band of fellow survivors fight to stay alive."
s666,TV Show,Deadwind,,"Pihla Viitala, Lauri Tilkanen, Jani Volanen, Tommi Korpela, Pirjo Lonka, Riku Nieminen, Pamela Tola, Jonna Järnefelt, Raimo Grönberg","Finland, Germany","June 19, 2021",2020,TV-MA,2 Seasons,"Crime TV Shows, International TV Shows, TV Dramas","Just months after a tragic loss, detective Sofia Karppi investigates the murder of a woman with ties to a Helsinki construction company."
s3041,TV Show,Until Dawn,,"Ahmed Sylla, Alban Ivanov, Ornella Fleury, Natoo, Carlito, Mcfly, Djimo, Lola Dubini, Noom Diawara, Tania Dutel, Hakim Jemili, Jason Brokerss, Bérengère Krief, Thomas Vandenberghe, Monsieur Poulpe, Jhon Rachid, Audrey Pirault, Jeanfi Janssens, Fadily Camara, Laurie Peret, Issa Doumbia, Anne-Sophie Girard, Elhadj Gaye, Guillaume Bats",France,"January 10, 2020",2020,TV-MA,1 Season,"International TV Shows, Reality TV, TV Comedies",France’s funniest comics carry out ghastly tasks as they try to outlast – and outwit – one another while overnighting in haunted locations.
s5856,TV Show,Justin Time,,"Gage Munroe, Scott McCord, Jenna Warren",Canada,"April 1, 2016",2012,TV-Y,2 Seasons,Kids' TV,"In Justin's dreams, he and his imaginary friends Olive and Squidgy travel around the world learning about nature and other cultures."
s3076,TV Show,Spinning Out,,"Kaya Scodelario, January Jones, Will Kemp, Willow Shields, Evan Roderick, David James Elliott, Sarah Wright Olsen, Svetlana Efremova, Amanda Zhou, Mitchell Edwards, Kaitlyn Leeb, Johnny Weir",United States,"January 1, 2020",2020,TV-MA,1 Season,TV Dramas,"A figure skating Olympic hopeful struggles to balance love, family and fragile mental health as her dream of winning takes a dizzying hold."
s3294,TV Show,Little Things,,"Dhruv Sehgal, Mithila Palkar",India,"November 9, 2019",2019,TV-MA,3 Seasons,"International TV Shows, Romantic TV Shows, TV Comedies","A cohabiting couple in their 20s navigate the ups and downs of work, modern-day relationships and finding themselves in contemporary Mumbai."
s3123,TV Show,Soundtrack,,"Paul James, Callie Hernandez, Marianne Jean-Baptiste, Jenna Dewan, Jahmil French, Megan Ferguson, Madeleine Stowe, Campbell Scott, Isaiah Givens",United States,"December 18, 2019",2019,TV-MA,1 Season,"Romantic TV Shows, TV Dramas","Love, loss and transformative luck intersect in this musical drama about two struggling artists experiencing life at full volume in Los Angeles."
s2,TV Show,Blood & Water,,"Ama Qamata, Khosi Ngema, Gail Mabalane, Thabang Molaba, Dillon Windvogel, Natasha Thahane, Arno Greeff, Xolile Tshabalala, Getmore Sithole, Cindy Mahlangu, Ryle De Morny, Greteli Fincham, Sello Maake Ka-Ncube, Odwa Gwanya, Mekaila Mathys, Sandi Schultz, Duane Williams, Shamilla Miller, Patrick Mofokeng",South Africa,"September 24, 2021",2021,TV-MA,2 Seasons,"International TV Shows, TV Dramas, TV Mysteries","After crossing paths at a party, a Cape Town teen sets out to prove whether a private-school swimming star is her sister who was abducted at birth."
s5049,TV Show,Coach Snoop,,Snoop Dogg,United States,"February 2, 2018",2018,TV-MA,1 Season,"Docuseries, Reality TV","Fueled by his own rough upbringing, Snoop Dogg creates a youth football league to keep at-risk kids off the streets and focused on their goals."
s2410,TV Show,Reality Z,,"Ana Hartmann, Sabrina Sato, Luellem de Castro, Guilherme Weber, Emílio de Mello, Ravel Andrade, João Pedro Zappa, Julia Ianina, Pierre Baitelli, Jesus Luz, Carla Ribas, Wallie Ruy, Gabriel Canella, Natália Rosa, Priscila Assum, Teca Pereira, Leandro Daniel, Hanna Romanazzi, Arlinda Di Baio, Erom Cordeiro, Enzo Romani",Brazil,"June 10, 2020",2020,TV-MA,1 Season,"International TV Shows, TV Horror, TV Mysteries","With Rio de Janeiro under a zombie attack, reality show contestants shelter in a TV studio, where they must deal with more than flesh-eating hordes."
s4554,TV Show,Monty Python's Personal Best,,"John Cleese, Terry Gilliam, Terry Jones, Graham Chapman, Michael Palin, Eric Idle","United States, United Kingdom","October 2, 2018",2005,TV-MA,1 Season,"British TV Shows, TV Comedies",Original members of the iconic Monty Python comedy troupe pick their all-time favorite sketches from their groundbreaking television series.
s6975,TV Show,Historia de un clan,,"Alejandro Awada, Cecilia Roth, Chino Darín, Nazareno Casero, Tristán, Gustavo Garzón, Pablo Cedrón, María Soldi, Rita Pauls, Victoria Almeida, Benjamín Alfonso",Argentina,"January 13, 2017",2015,TV-MA,1 Season,"Crime TV Shows, International TV Shows, Spanish-Language TV Shows","This drama based on a true story follows the Puccios, a criminal family who kidnaps wealthy people and holds them hostage in their home."
s1782,TV Show,Somebody Feed Phil,,Philip Rosenthal,United States,"October 30, 2020",2020,TV-14,4 Seasons,"Docuseries, Reality TV","""Everybody Loves Raymond"" creator Phil Rosenthal travels the globe to take in the local cuisine and culture of Bangkok, Lisbon, Mexico City and more."
s6825,TV Show,Game Winning Hit,,"Lego Lee, Alice Ko, Afalean Lu, Tsai Chen-nan, Wang Chuan, Leiya Gao, Charlize Lin",Taiwan,"September 1, 2016",2009,TV-MA,1 Season,"International TV Shows, TV Comedies, TV Dramas",An army deserter hiding out in a small coastal town becomes the coach of a youth baseball team and develops warm relationships in his new community.
s5769,TV Show,Love Cheque Charge,,"George Hu, Phoebe Yuan, Hsieh Kun Da, Jay Shih, Smile Weng, Jet Chao, Jessie Chang",Taiwan,"October 1, 2016",2014,TV-14,1 Season,"International TV Shows, Romantic TV Shows, TV Comedies","Three years after making a wild promise to a woman in distress, a rigid businessman runs into her again and must decide whether to honor his word."
s1464,TV Show,The Cat in the Hat Knows a Lot About That!,Tony Collingwood,"Martin Short, Alexa Torrington, Jacob Ewaniuk, Robert Tinkler, Tracey Hoyt","Canada, United Kingdom, United States","January 1, 2021",2014,TV-Y,1 Season,Kids' TV,"The Cat in the Hat is back – and this time, he's teaching Sally and her brother, Nick, some awfully nifty things to think about!"
s6305,TV Show,"Big Dreams, Small Spaces",,Monty Don,United Kingdom," July 26, 2019",2017,TV-G,3 Seasons,"British TV Shows, International TV Shows, Reality TV",Writer and presenter Monty Don helps England's budding horticulturists plant and grow the gardens of their dreams.
s8149,TV Show,Tales of the City (1993),,"Olympia Dukakis, Donald Moffat, Laura Linney, Marcus D'Amico, Billy Campbell, Thomas Gibson, Paul Gross, Barbara Garrick, Chloe Webb, Nina Foch, Parker Posey, Stanley DeSantis","United Kingdom, United States","June 28, 2019",1993,TV-MA,1 Season,TV Dramas,"In 1976, naive Mary Ann Singleton moves to San Francisco and finds a new family in her bohemian landlady and the eclectic residents at 28 Barbary Lane."
s1749,TV Show,60 Days In,,,United States,"November 1, 2020",2019,TV-MA,1 Season,Reality TV,"Recruited by a sheriff, volunteers infiltrate county prisons to expose corruption and crime from within the system in this docuseries."
s664,TV Show,Charité at War,,"Mala Emde, Ulrich Noethen, Jannik Schümann, Artjom Gilz, Luise Wolfram, Jacob Matschenz, Frida-Lovisa Hamann, Lukas Miko, Susanne Böwe",,"June 19, 2021",2019,TV-MA,1 Season,"International TV Shows, TV Dramas","In 1943, the staff at Berlin's Charité hospital struggle against the effects of World War II and the Nazi regime, including eugenic medical practices."
s3771,TV Show,Tales of the City,,"Laura Linney, Ellen Page, Olympia Dukakis, Paul Gross, Murray Bartlett, Barbara Garrick, Charlie Barnett, Garcia, May Hong, Jen Richards, Victor Garber, Ashley Park, Christopher Larkin, Zosia Mamet, Molly Ringwald, Daniela Vega",United States,"June 7, 2019",2019,TV-MA,1 Season,TV Dramas,"Returning to San Francisco after a long absence, Mary Ann Singleton reunites with the community of characters at 28 Barbary Lane."
s4306,TV Show,Inside the Real Narcos,,Jason Fox,,"December 14, 2018",2018,TV-MA,1 Season,"British TV Shows, Crime TV Shows, Docuseries","Exposing a rarely seen perspective on the drug wars, ex-Special Forces commando Jason Fox interviews dangerous traffickers and cartel members."
s5678,TV Show,Tokyo Trial,,"Marcel Hensema, Paul Freeman, Irrfan Khan, Stacy Keach, Michael Ironside, Stephen McHattie, Shinya Tsukamoto","Canada, Japan, Netherlands","December 13, 2016",2017,TV-MA,1 Season,"International TV Shows, TV Dramas","In the wake of World War II, 11 Allied judges are tasked with weighing the fates of Japanese war criminals in a tense international trial."
s5005,TV Show,21 Thunder,,"Stephanie Bennett, Emmanuel Kabongo, RJ Fetherstonhaugh, Andres Joseph, Kevin Claydon, Conrad Pla, Clark Backo, Ryan Pierce, Eileen Li, Susan Bain, Cristina Rosato, Jonathan Kim, Colm Feore",Canada,"March 1, 2018",2017,TV-MA,1 Season,"Crime TV Shows, International TV Shows, TV Dramas","Players and coaches for a Montreal soccer team chase dreams of stardom while their personal lives erupt with love, fear, passion and violence."
s8021,TV Show,Silver Spoon,,"Pavel Priluchnyy, Karina Razumovskaya, Dmitry Shevchenko, Denis Shvedov, Alexander Oblasov, Igor Zhizhikin, Bogdan Stypka, Alexander Dyachenko",Russia,"September 15, 2017",2015,TV-MA,2 Seasons,"Crime TV Shows, International TV Shows, TV Action & Adventure","Forced to become an apprentice cop, cocky playboy Igor finds he's got a knack for police work. But his job soon takes him down a dark personal path."
s5404,TV Show,The Oath,,"Christopher Lee, Jesseca Liu, Ann Kok, Kate Pang, Zhang Zhenhuan, Richard Low",Singapore,"July 1, 2017",2011,TV-14,1 Season,"International TV Shows, Romantic TV Shows, TV Dramas","Two doctors with opposite approaches to treating patients clash on the job and must learn to trust each other's expertise, allowing love to bloom."
s1372,TV Show,We Are: The Brooklyn Saints,,,United States,"January 29, 2021",2021,TV-14,1 Season,Docuseries,A Brooklyn youth football program and its selfless coaches provide a safe haven for kids to compete and learn lessons that will take them far in life.
s2086,TV Show,I AM A KILLER: RELEASED,,,"United Kingdom, United States","August 28, 2020",2020,TV-MA,1 Season,"British TV Shows, Crime TV Shows, Docuseries","In this crime docuseries spinoff, a convict is paroled 30 years after being sentenced to death for murder. Then he makes a stunning confession."
s1144,TV Show,Worn Stories,,,United States,"April 1, 2021",2021,TV-MA,1 Season,"Docuseries, Reality TV","In this funny, heartfelt and moving docuseries, real people unpack the fascinating and quirky stories around their most meaningful pieces of clothing."
s3825,TV Show,I Hear You,,"Riley Wang, Zhao Lusi, Zhang Jiongmin, Gratitude Dai, Yuan Hao",,"May 15, 2019",2019,TV-14,1 Season,"International TV Shows, Romantic TV Shows, TV Dramas","Love blooms between a bubbly, aspiring voice actress and a cool, enigmatic violin-maker after they cross paths on a reality TV show."
s15,TV Show,Crime Stories: India Detectives,,,,"September 22, 2021",2021,TV-MA,1 Season,"British TV Shows, Crime TV Shows, Docuseries",Cameras following Bengaluru police on the job offer a rare glimpse into the complex and challenging inner workings of four major crime investigations.
s4635,TV Show,Transformers: Rescue Bots,,"Lacey Chabert, Elan Garfias, Maurice LaMarche, Jason Marsden, Shannon McKain, Steve Blum, Parvesh Cheena, D.C. Douglas, Imari Williams, LeVar Burton, Diamond White","Canada, United States","September 19, 2018",2016,TV-Y7,1 Season,Kids' TV,"Follow the adventure of four young transformers, Heatwave, Chase, Blades and Boulder, and their human counterparts: a family of emergency responders."
s5668,TV Show,Goodbye My Wife,,"Soo-hyun Hong, Si Won Ryu, Ji-yoon Park, Min-soo Kim, Julien Kang, Joo-eun Oh, Seong-mo Jeong",South Korea,"December 15, 2016",2012,TV-14,1 Season,"International TV Shows, Korean TV Shows, Romantic TV Shows",A couple’s five-year marriage is put on the line when each of their first loves comes back hoping for another shot at romance.
s5857,TV Show,Terrace House: Boys & Girls in the City,,"You, Reina Triendl, Ryota Yamasato, Yoshimi Tokui, Azusa Babazono, Ayumu Mochizuki, Kentaro",Japan,"April 1, 2016",2016,TV-14,2 Seasons,"International TV Shows, Reality TV","A new set of six men and women start their lives together under one roof. All they get is a fabulous home and a car. As always, there is no script."
s6102,TV Show,Age of Glory,,"Debbie Goh, Aenie Wong, Frederick Lee, Leslie Chai",,"August 14, 2017",2010,TV-MA,2 Seasons,"International TV Shows, Romantic TV Shows, TV Dramas","Amid the thriving nightlife of 1960s Kuala Lumpur, three Chinese friends – a showgirl, her housekeeper and a chanteuse – find love and heartbreak."
s4909,TV Show,Goodnight DJ 1,,"Chan Fong, Z-Chen, Frederick Lee, Melvin Sia, Chris Tong, Rickman Chia, Henley Hii",,"April 27, 2018",2016,TV-14,2 Seasons,"International TV Shows, TV Dramas, TV Horror","Young radio announcers from varying backgrounds encounter the supernatural in mysterious dreams, accidents and everyday life."
s1384,TV Show,Blown Away,,,Canada,"January 22, 2021",2021,TV-14,2 Seasons,"International TV Shows, Reality TV","Ten master artists turn up the heat in glassblowing sculpture challenges for the chance to win $60,000 in prizes and the title of champion."
