show_id,type,title,director,cast,country,date_added,release_year,rating,duration,listed_in,description
s3639,Movie,Eerie,Mikhail Red,"Bea Alonzo, Jake Cuenca, Maxene Magalona, Charo Santos, Mary Joy Apostol, Gabby Padilla, Gillian Vicencio","Philippines, Singapore","July 26, 2019",2019,TV-14,100 min,"Horror Movies, International Movies","When a student's suicide rattles an all-girls Catholic school, a clairvoyant guidance counselor leans on a ghost to uncover the convent's abusive past."
s7627,Movie,Numero Zero. The Roots of Italian Rap,Enrico Bisi,,Italy,"April 15, 2018",2015,TV-MA,91 min,"Documentaries, International Movies, Music & Musicals","In the '90s, the explosive popularity of hip-hop music in Italy impacts the nation's character while creating a new kind of renegade artist."
s397,Movie,Blood Red Sky,Peter Thorwarth,"Peri Baumeister, Alexander Scheer, Kais Setti, Carl Koch, Gordon Brown, Roland Møller, Chidi Ajufo, Kai Ivo Baulitz, Graham McTavish, Dominic Purcell",,"July 23, 2021",2021,TV-MA,123 min,"Action & Adventure, Horror Movies, International Movies","When a group of terrorists hijacks an overnight transatlantic flight, a mysteriously ill woman must unleash a monstrous secret to protect her young son."
s6261,Movie,Bean: The Ultimate Disaster Movie,Mel Smith,"Rowan Atkinson, Peter MacNicol, John Mills, Pamela Reed, Harris Yulin, Burt Reynolds, Larry Drake, Danny Goldring, Johnny Galecki, Chris Ellis, Andrew Lawrence, Peter Egan, Peter Capaldi, June Brown, Peter James, Sandra Oh","United Kingdom, United States","August 1, 2018",1997,PG-13,89 min,"Comedies, International Movies","Disaster-prone Mr. Bean is sent to Los Angeles to guard a famous painting, but as he's unfit for any physical task, everything goes hilariously wrong."
s3907,Movie,Franco Escamilla: Bienvenido al mundo,Ulises Valencia,Franco Escamilla,Mexico,"April 17, 2019",2019,TV-MA,54 min,Stand-Up Comedy,"Comedian Franco Escamilla shares stories about parenting his children when they get into trouble, with reflections on gender, friendship and romance."
s7516,Movie,Movie 43,"Peter Farrelly, Will Graham, Steve Carr, Griffin Dunne, Steve Brill, James Duffy, Jonathan van Tulleken, Elizabeth Banks, Patrik Forsberg, Brett Ratner, Rusty Cundieff, James Gunn","Greg Kinnear, Dennis Quaid, Common, Seth MacFarlane, Will Sasso, Hugh Jackman, Kate Winslet, Liev Schreiber, Naomi Watts, Anna Faris, Chris Pratt, J.B. Smoove, Kieran Culkin, Emma Stone, Cathy Cliften, Kristen Bell, Leslie Bibb, Bobby Cannavale, John Hodgman, Justin Long, Jason Sudeikis, Uma Thurman, Phil Crowley, Kate Bosworth, Richard Gere, Jack McBrayer, Aasif Mandvi, Christopher Mintz-Plasse, Chloë Grace Moretz, Matt Walsh, Patrick Warburton, Gerard Butler, Johnny Knoxville, Seann William Scott, Halle Berry, Stephen Merchant, Terrence Howard, Elizabeth Banks, Josh Duhamel",United States,"April 9, 2019",2013,R,94 min,Comedies,"An eye-popping cast stars in this sketch-comedy collage, the new millennium's homage to classic anthology films like The Kentucky Fried Movie."
s3975,Movie,Nate Bargatze: The Tennessee Kid,Ryan Polito,Nate Bargatze,United States,"March 26, 2019",2019,TV-PG,61 min,Stand-Up Comedy,"Comic Nate Bargatze touches on air travel, cheap weddings, college football, chocolate milk and the perils of ordering coffee in this stand-up special."
s7877,Movie,Roberto Saviano: Writing Under Police Protection,Pierfrancesco Diliberto,Pierfrancesco Diliberto,Italy,"May 1, 2018",2016,TV-14,45 min,"Documentaries, International Movies","Italian TV host Pif revisits Roberto Saviano, who's been living under protection since publishing ""Gomorrah,"" his exposé on organized crime in Naples."
s147,Movie,House Party 3,Eric Meza,"Christopher Reid, Christopher Martin, Tisha Campbell, David Edwards, Angela Means, Ketty Lester, Bernie Mac, Michael Colyar, Chris Tucker, Khandi Alexander",United States,"September 1, 2021",1994,R,94 min,"Comedies, Music & Musicals","After Kid gets engaged, Play plans to throw the biggest bachelor party ever. But every celebration for these two always comes with complications."
s2349,Movie,The Royal Hibiscus Hotel,Ishaya Bako,"Zainab Balogun, Kenneth Okolie, Deyemi Okanlawon, Joke Silva, Olu Jacobs, Jide Kosoko, Rachel Oniga, Kemi Lala Akindoju, Ini Dima-Okojie, Toni Tones",Nigeria,"June 22, 2020",2017,TV-PG,90 min,"Comedies, International Movies, Romantic Movies",A disenchanted chef tries to help her parents restore their failing hotel but cooks up feelings for an investor with his sights set on the property.
s7357,Movie,Loving Annabelle,Katherine Brooks,"Erin Kelly, Diane Gaidry, Laura Breckenridge, Michelle Horn, Gustine Fudickar, Ilene Graff, Kevin McCarthy, Markus Flanagan",United States,"July 1, 2018",2006,TV-MA,77 min,"Dramas, Independent Movies, LGBTQ Movies",An esteemed young poetry teacher at a Catholic boarding school risks everything when she engages in a feverish affair with a female student.
s2723,Movie,Duplicate,Mahesh Bhatt,"Shah Rukh Khan, Juhi Chawla, Sonali Bendre, Farida Jalal, Mohnish Bahl, Tiku Talsania, Gulshan Grover, Sharat Saxena",India,"April 1, 2020",1998,TV-14,165 min,"Comedies, Dramas, International Movies","Hilarious mix-ups and deadly encounters ensue when a convict seeks to escape authorities by assuming the identity of his doppelgänger, a perky chef."
s497,Movie,Brick Mansions,Camille Delamarre,"Paul Walker, David Belle, RZA, Gouchy Boy, Catalina Denis, Ayisha Issa, Carlo Rota, Andreas Apergis, Richard Zeman, Robert Maillet","France, Canada, United States, Spain","July 7, 2021",2014,PG-13,90 min,"Action & Adventure, International Movies",An undercover police detective partners with an ex-convict to take down a drug kingpin amid grime and crime in a walled-off Detroit housing project.
s1475,Movie,Tarung Sarung,Archie Hekagery,"Panji Zoni, Yayan Ruhian, Maizura, Cemal Farukh, Imelda Therinne, Surya Saputra, Jarot Superdj, Doyok Superdj, Hajra Romessa, Annette Edoarda",Indonesia,"December 31, 2020",2020,TV-PG,116 min,"Action & Adventure, Dramas, Faith & Spirituality","Wealthy and spoiled, a young man finds something to fight for when he falls in love with an environmental activist protesting his family's business."
s3555,Movie,Unbridled,Jota Linares,"Natalia de Molina, Daniel Grao, Natalia Mateo, Ignacio Mateos, Borja Luna, Mario Tardón, Mariana Cordero",Spain,"August 30, 2019",2018,TV-MA,100 min,"International Movies, Thrillers","Desperate to keep her husband’s secret, a devoted politician’s wife struggles to stave off threats that could ruin their promising new life."
s8404,Movie,The Look of Silence,Joshua Oppenheimer,,"Denmark, Indonesia, Finland, Norway, United Kingdom, Israel, France, United States, Germany, Netherlands","February 26, 2016",2014,PG-13,103 min,"Documentaries, International Movies","In a society terrorized into silence, the brother of a 1960s Indonesian genocide victim learns the identity of his murderers and confronts them."
s3998,Movie,Imago,"Karan Shivajirao Chavan, Vikram Tanajirao Patil","Aishwarya Ghaydar, Amol Deshmukh, Adarsh Kurne, Vishwas Kamble, Neha Awati, Amaraja Patil, Rinkle Chopde, Shreyas Gurav",India,"March 20, 2019",2018,TV-PG,97 min,"Dramas, Independent Movies, International Movies","A teen with vitiligo struggles with self-doubt and anxiety until a new schoolteacher sees her through a different lens, and urges her to do the same."
s30,Movie,Paranoia,Robert Luketic,"Liam Hemsworth, Gary Oldman, Amber Heard, Harrison Ford, Lucas Till, Embeth Davidtz, Julian McMahon, Josh Holloway, Richard Dreyfuss, Angela Sarafyan","United States, India, France","September 19, 2021",2013,PG-13,106 min,Thrillers,"Blackmailed by his company's CEO, a low-level employee finds himself forced to spy on the boss's rival and former mentor."
s5135,Movie,Craig Ferguson: Tickle Fight,Jay Chapman,Craig Ferguson,United States,"December 5, 2017",2017,TV-MA,67 min,Stand-Up Comedy,"Cheeky comic Craig Ferguson keeps it casual as he discusses '70s porn, Japanese toilets and his mildly crime-filled days as a talk show host."
s1354,Movie,Beverly Hills Ninja,Dennis Dugan,"Chris Farley, Nicollette Sheridan, Robin Shou, Nathaniel Parker, Soon-Tek Oh, Keith Cooke, Chris Rock, François Chau, Dale Ishimoto, Daming Chen",United States,"February 1, 2021",1997,PG-13,89 min,"Action & Adventure, Comedies","Raised by ninjas, a big-hearted but bumbling orphan travels to Beverly Hills on a mission to help a woman investigate her shady boyfriend."
s7184,Movie,Khalnayak,Subhash Ghai,"Sanjay Dutt, Madhuri Dixit, Jackie Shroff, Anupam Kher, Rakhee Gulzar, Pramod Moutho, Ramya Krishnan, Sushmita Mukherjee, Neena Gupta, A.K. Hangal",India,"March 1, 2018",1993,TV-14,170 min,"Action & Adventure, Dramas, International Movies",A prison guard goes undercover as a dancer to try and recapture an escaped criminal and restore her police inspector boyfriend's reputation.
s7553,Movie,Mythily Veendum Varunnu,Sabu Varghese,"Udhay, Kiran Raj, I.M. Vijayan, Sandhanam, Shivani Bhai, Sangeetha Balan",India,"August 1, 2018",2017,TV-PG,88 min,"Horror Movies, International Movies","After losing her father, a young woman moves to the city to earn money. When she finds a job at a mysterious bungalow, her worst nightmares come true."
s6527,Movie,Concussion,Stacie Passon,"Robin Weigert, Maggie Siff, Johnathan Tchaikovsky, Ben Shenkman, Janel Moloney, Emily Kinney",United States,"August 2, 2018",2013,R,96 min,"Dramas, Independent Movies, LGBTQ Movies","A lesbian housewife, feeling trapped in a stale marriage, begins visiting female prostitutes and soon seeks excitement by becoming a sex worker."
s5703,Movie,Rainbow Time,Linas Phillips,"Linas Phillips, Melanie Lynskey, Timm Sharp, Tobin Bell, Jay Duplass, Lauren Weedman, Artemis Pebdani, Reagan Yates, Austin Fryberger",United States,"December 1, 2016",2016,TV-MA,92 min,"Comedies, Dramas, Independent Movies","A developmentally disabled man obsessed with the Fonz, guns and all things kinky poses a challenge for his arrogant brother when he moves in with him."
s5954,Movie,Joseph: King of Dreams,"Rob LaDuca, Robert C. Ramirez","Ben Affleck, Mark Hamill, Richard Herd, Maureen McGovern, Jodi Benson, Judith Light, James Eckhouse, Richard McGonagle, David Campbell, Steven Weber, Dan Castellaneta, Rene Auberjonois, Ken Hudson Campbell, Tom Virtue, Jeff Bennett","United States, France, United Kingdom","September 27, 2011",2000,TV-PG,75 min,"Children & Family Movies, Dramas, Faith & Spirituality","With his gift of dream interpretation and his brilliantly colored coat, Joseph inspires jealousy in his brothers in this animated Bible story."
s5371,Movie,I Called Him Morgan,Kasper Collin,,"Sweden, United States","July 24, 2017",2016,TV-14,91 min,"Documentaries, Music & Musicals","Decades after serving a prison sentence for killing jazz musician Lee Morgan, his common-law wife, Helen, reflects on their lives and his legacy."
s8047,Movie,Sniper: Special Ops,Fred Olen Ray,"Steven Seagal, Rob Van Dam, Tim Abell, Charlene Amoia, Daniel Booko, Jason-Shane Scott, Anthony Batarse, Gerald Webb",United States,"January 10, 2020",2016,R,86 min,"Action & Adventure, Dramas","After a mission to rescue a U.S. congressman from the Taliban ends with two men left behind, their sniper buddies go against orders to get them back."
s8400,Movie,The Lodgers,Brian O'Malley,"Charlotte Vega, Bill Milner, David Bradley, Eugene Simon, Moe Dunford, Deirdre O'Kane, Roisin Murphy, Anthony Murphy, Brendan O'Rourke, Emmett Kelly",Ireland,"August 23, 2018",2017,R,93 min,"Horror Movies, International Movies","Twin siblings live under a curse in their ancestral home, but one of them is tempted to defy house rules, angering the spirits keeping them hostage."
s7465,Movie,Miss Hokusai,Keiichi Hara,"Anne Watanabe, Yutaka Matsushige, Gaku Hamada, Kengo Kora, Jun Miho, Shion Shimizu, Michitaka Tsutsui, Ethan Murray, Kevin T. Collins, Barbara Goodson, Cindy Robinson, Mike Pollock, Robbie Daymond, Marc Diraison, Richard Epcar, Erica Lindbeck",Japan,"October 1, 2017",2015,PG-13,90 min,Anime Features,"Herself a talented artist, O-Ei works with her father, Tetsuzo, later known as Hokusai, on the woodblock prints that would make Edo famous worldwide."
s3232,Movie,True: Winter Wishes,,"Michela Luci, Jamie Watson, Eric Peterson, Anna Claire Bartlam, Nicolas Aqui, Cory Doran, Julie Lemieux, Derek McGrath",,"November 26, 2019",2019,TV-Y,46 min,Children & Family Movies,"An ice crystal from a frosty realm is freezing everything in the Rainbow Kingdom, its citizens too! Can True save Winter Wishfest – and her friends?"
s1398,Movie,A Monster Calls,J.A. Bayona,"Lewis MacDougall, Sigourney Weaver, Felicity Jones, Liam Neeson, Toby Kebbell, Ben Moor, James Melville, Oliver Steer, Dominic Boyle, Geraldine Chaplin, Jennifer Lim","United Kingdom, Spain, United States","January 16, 2021",2016,PG-13,108 min,"Dramas, Sci-Fi & Fantasy","Overwhelmed by his mother’s illness, a young boy begins to understand human complexity through the fantastic tales of a consoling tree monster."
s180,Movie,The Nutty Professor,Tom Shadyac,"Eddie Murphy, Jada Pinkett Smith, James Coburn, Larry Miller, Dave Chappelle, John Ales, Patricia Wilson, Jamal Mixon",United States,"September 1, 2021",1996,PG-13,95 min,"Comedies, Romantic Movies","After being made fun of for his weight, a kind and brainy professor takes a dose of a revolutionary formula that changes more than just his appearance."
s557,Movie,The 8th Night,Kim Tae-hyung,"Lee Sung-min, Park Hae-joon, Kim You-jung, Nam Da-reum, Choi Jin-ho, Kim Dong-yeong, Lee Eal",South Korea,"July 2, 2021",2021,TV-14,116 min,"Horror Movies, International Movies, Thrillers","With prayer beads in one hand and an ax in the other, a monk hunts down a millennia-old spirit that's possessing humans and unleashing hell on Earth."
s6622,Movie,Dolphin Kick,Philip Marlatt,"Axle McCoy, Travis McCoy, Tyler Jade Nixon, Alexis Louder, DeVaughn Gow, LaVaughn Hamilton, Maya Simmons, Quddus Newton, Jordan Padreira, Derek Lee Nixon",United States,"June 5, 2019",2019,TV-PG,90 min,Children & Family Movies,"After losing his mom, 10-year-old Luke abandons competitive swimming. It takes a friendly dolphin to get him back in the water – and help him heal."
s1432,Movie,Stuck Apart,,"Engin Günaydın, Haluk Bilginer, Binnur Kaya, Öner Erkan, İrem Sak, Fatih Artman, Gülçin Santırcıoğlu, İlker Aksum, Hülya Duyar, Göktuğ Yıldırım, Helin Kandemir",Turkey,"January 8, 2021",2021,TV-MA,97 min,"Comedies, Dramas, International Movies","Entrenched in a midlife crisis, Aziz seeks solace from his mundane job, lonesome friends and rowdy family while pretending to have his act together."
s3173,Movie,Spirit Riding Free: Spirit of Christmas,,"Amber Frank, Bailey Gambertoglio, Sydney Park, Evan Agos, Kay Bess, Darcy Rose Byrnes, David Faustino, Gabriella Graves, Duncan Joiner, Katherine McNamara, Nolan North, Tiya Sircar",United States,"December 6, 2019",2019,TV-Y7,46 min,Children & Family Movies,Lucky and friends must figure out how to get home in time for Christmas when a falling boulder – and a serious snowstorm – derail their travel plans.
s3594,Movie,Uyare,Manu Ashokan,"Parvathy, Asif Ali, Tovino Thomas, Siddique, Pratap Pothan, Samyuktha Menon, Anarkali Marikar, Prem Prakash",India,"August 14, 2019",2019,TV-14,119 min,"Dramas, International Movies",An aspiring pilot fights for her future – and justice – after surviving an acid attack from her abusive boyfriend.
s2377,Movie,The Land,Youssef Chahine,"Hamdy Ahmed, Nagwa Ibrahim, Ezzat El Alaili, Tawfik El Deken, Yehia Chahine, Mahmoud El Meleigy, Salah El-Saadany, Ali El Sherif",Egypt,"June 18, 2020",1970,TV-MA,130 min,"Classic Movies, Dramas, International Movies",A group of peasant farmers fights to protect their village against a corrupt landowner. Adapted from the popular novel by Abdel Rahman al-Sharqawi.
s2104,Movie,Class of '83,Atul Sabharwal,"Bobby Deol, Bhupendra Jadawat, Hitesh Bhojraj, Anup Soni, Joy Sengupta, Sameer Paranjape, Ninad Mahajani, Prithvik Pratap",India,"August 21, 2020",2020,TV-14,98 min,"Dramas, International Movies, Thrillers","Demoted to an academy job, a cop trains five foolhardy students as assassins in his risky revenge plot against police corruption and the underworld."
s865,Movie,Taxi No. 9211,Milan Luthria,"Nana Patekar, John Abraham, Sameera Reddy, Sonali Kulkarni, Shivaji Satham, Nassar Abdulla, Kurush Deboo, Smita Jaykar",,"May 20, 2021",2006,TV-14,116 min,"Dramas, International Movies, Thrillers","When an arrogant scion hails his taxi, a cabbie in desperate need of money sees an opportunity that kicks off an intensely contentious 24-hour showdown."
s623,Movie,Lying and Stealing,Matt Aselton,"Theo James, Emily Ratajkowski, Fred Melamed, Ebon Moss-Bachrach, Isiah Whitlock Jr., Evan Handler, Paul Jurewicz, John Gatins, Fernanda Andrade, Bob Stephenson",United States,"June 30, 2021",2019,R,100 min,Thrillers,"A talented thief teams up with an aspiring actress to steal art from LA's high rollers. For their last heist, they're going for the ultimate: freedom."
s8515,Movie,The spiral,Krzysztof Zanussi,"Jan Nowicki, Maja Komorowska, Zofia Kucówna, Aleksander Bardini, Jan Świderski, Seweryna Broniszówna, Piotr Garlicki, Marian Glinka",Poland,"October 1, 2019",1978,TV-MA,84 min,"Dramas, Independent Movies, International Movies","When an unbearable stranger arrives at a winter mountain resort and vanishes overnight, his dark past comes to light."
s1664,Movie,Dolly Parton’s Christmas on the Square,Debbie Allen,"Dolly Parton, Christine Baranski, Treat Williams, Jenifer Lewis, Josh Segarra, Jeanine Mason, Mary Lane Haskell",United States,"November 22, 2020",2020,TV-PG,99 min,"Children & Family Movies, Music & Musicals","Seasonal cheer comes to a screeching halt when a cold-hearted woman tries to sell her hometown's land. Can music, magic and memories change her mind?"
s7004,Movie,Hot Bot,Michael Polish,"Cynthia Kirchner, Doug Haley, Zack Pearlman, Larry Miller, Danny Masterson, Anthony Anderson, David Shackelford, Donald Faison, Angela Kinsey, Kirby Bliss Blanton, John Robinson",United States,"March 1, 2016",2016,NR,93 min,Comedies,"Two teenage geeks inadvertently find a lifelike, state-of-the-art sex robot, but must dodge the high-profile owner who lost her in order to keep her."
s4008,Movie,Jeff Dunham: Arguing with Myself,Manny Rodriguez,Jeff Dunham,United States,"March 15, 2019",2006,TV-MA,69 min,Stand-Up Comedy,"Playing straight man to partners half his size, ventriloquist Jeff Dunham – one of America's funniest comics – slays audiences across the country."
s7493,Movie,Monster High: Freaky Fusion,"William Lau, Sylvain Blais","Cam Clarke, Audu Paden, Laura Bailey, Cindy Robinson, Erin Fitzgerald, Kate Higgins, Salli Saffioti, Sue Swan, Haviland Stillwell, Paula Rhodes, America Young, Stephanie Sheh, Josey Montana McCoy",United States,"January 30, 2018",2014,TV-Y7,74 min,Children & Family Movies,"When Frankie Stein travels back in time, a teen scientist follows her home into the present and causes a lab accident that creates four new monsters."
s6910,Movie,Hairspray,Adam Shankman,"Nikki Blonsky, John Travolta, Michelle Pfeiffer, Christopher Walken, Amanda Bynes, James Marsden, Queen Latifah, Zac Efron, Brittany Snow, Allison Janney, Elijah Kelley, Jerry Stiller","United States, United Kingdom, Canada","January 1, 2020",2007,PG,116 min,"Children & Family Movies, Comedies, Music & Musicals","In 1962, ambitious plus-size teen Tracy Turnblad tries to integrate a racially divided Baltimore one Watusi at a time."
s5154,Movie,The Girl from the Song,Ibai Abad,"Lewis Rainer, Josephine Berry, Charlotte Atkinson, Charles MacGechan",Spain,"November 24, 2017",2016,TV-MA,101 min,"Dramas, Independent Movies, International Movies","When an aspiring musician falls for a carefree college student, he follows her to the Nevada desert to declare his love to her and find himself."
s6861,Movie,God of War,Gordon Chan,"Vincent Zhao, Sammo Kam-Bo Hung, Regina Wan, Yasuaki Kurata, Keisuke Koide, Timmy Hung, Michael Tong","China, Hong Kong","December 16, 2017",2017,NR,129 min,"Action & Adventure, International Movies",A maverick leader and a clever young general take on Japanese pirates amid bureaucratic intrigue in Ming Dynasty China.
s6286,Movie,Berlin Kaplani,Hakan Algül,"Ata Demirer, Necati Bilgiç, Tarık Ünlüoğlu, Özlem Türkad, Nihal Yalçın, Cemil Özbayer, Cengiz Bozkurt, Orhan Güner, Mert Aran",Turkey,"March 10, 2017",2012,TV-14,99 min,"Comedies, International Movies, Sports Movies","After a losing streak puts him in debt of 50,000 euros to his sponsors, an unlikely Turkish-German boxer in Berlin finds himself in need of a miracle."
s6513,Movie,Coffee with D,Vishal Mishra,"Sunil Grover, Zakir Hussain, Anjana Sukhani, Dipannita Sharma, Pankaj Tripathi, Rajesh Sharma, Vinod Ramani, Guru Singh",India,"November 1, 2017",2017,TV-PG,120 min,"Comedies, Independent Movies, International Movies",Low TV ratings drive a well-known journalist to concoct a plan to interview a notorious underworld figure who is also a suspected terrorist.
s5345,Movie,Message from the King,Fabrice Du Welz,"Chadwick Boseman, Luke Evans, Teresa Palmer, Alfred Molina, Natalie Martinez, Tom Felton, Dale Dickey, Sibongile Mlambo","United Kingdom, France, Belgium, United States","August 4, 2017",2017,R,103 min,"Independent Movies, Thrillers","On a relentless quest to avenge his sister's murder, a man from Cape Town infiltrates a sprawling network of lowlifes and elites in Los Angeles."
s1371,Movie,The Dig,Simon Stone,"Carey Mulligan, Ralph Fiennes, Lily James, Johnny Flynn, Ben Chaplin, Ken Stott",United Kingdom,"January 29, 2021",2021,PG-13,113 min,"Dramas, International Movies","On the eve of World War II, a British widow hires a self-taught archaeologist to dig up mysterious formations on her land, leading to a staggering find."
s4654,Movie,City of Joy,Madeleine Gavin,,"United States,","September 7, 2018",2018,TV-MA,77 min,Documentaries,"Women who've been sexually brutalized in war-torn Congo begin to heal at City of Joy, a center that helps them regain a sense of self and empowerment."
s999,Movie,Searching For Sheela,,Ma Anand Sheela,India,"April 22, 2021",2021,TV-14,58 min,"Documentaries, International Movies",Journalists and fans await Ma Anand Sheela as the infamous former Rajneesh commune’s spokesperson returns to India after decades for an interview tour.
s2565,Movie,One Day: Justice Delivered,Ashok Nanda,"Anupam Kher, Esha Gupta, Kumud Mishra, Kashyap Bharbhaya, Anusmiritu Sarkar, Zakir Hussain, Rajesh Sharma, Murli Sharma, Ananth Narayan Mahadevan, Deepshikha",India,"May 3, 2020",2019,TV-14,120 min,"Dramas, International Movies","A former judge in retirement finds and punishes the culprits he could not convict in court, spurring a crime branch officer to investigate."
s4283,Movie,Miss J Contemplates Her Choice,Jason Lai,"Kit Chan, Xiang Yun, Bobby Tonelli, Shane Pow, Seraph Sun, Marcus Chiau, Sierra Bustos, Amy Cheng, Lin Yu Hui, Youyi",Singapore,"December 20, 2018",2014,TV-MA,89 min,"Dramas, International Movies, Thrillers",The life of a radio talk-show host is turned upside down after a murderous caller dials into her program and asks her to choose his next victim.
s8343,Movie,The Heretics,Chad Archibald,"Nina Kiri, Ry Barrett, Jorja Cadence, Will King, Nina Richmond",Canada,"September 4, 2019",2017,TV-MA,88 min,Horror Movies,A withdrawn young woman hunted by a malicious cult is abducted by a brooding stranger and undergoes a bizarre transformation.
s6646,Movie,Dragonkala Ka Rahasya,Rajiv Chilaka,,,"June 18, 2019",2018,TV-Y,68 min,Children & Family Movies,"Bheem helps to reopen Dragonpur's abandoned magic and martial arts school, but is tested like never before when an ex-student returns seeking revenge!"
s3204,Movie,Why Me?,Tudor Giurgiu,"Emilian Oprea, Mihai Constantin, Andreea Vasile, Dan Condurache, Liviu Pintileasa, Mihai Smarandache, Alin Florea, Lucretia Mandric","Romania, Bulgaria, Hungary","December 1, 2019",2015,TV-MA,126 min,"Dramas, International Movies, Thrillers",A young prosecutor is assigned a career-making case involving a colleague but soon starts to question the motivations behind the charges.
s3273,Movie,K-on! the movie,Naoko Yamada,"Aki Toyosaki, Yoko Hikasa, Satomi Sato, Minako Kotobuki, Ayana Taketatsu, Asami Sanada, Madoka Yonezawa, Chika Fujito, Yoriko Nagata",Japan,"November 15, 2019",2011,TV-PG,110 min,"Anime Features, Music & Musicals",The seniors in Sakuragaoka High School's music club live out the graduation trip of their dreams when they celebrate by performing in London.
s4576,Movie,Kaminey,Vishal Bhardwaj,"Shahid Kapoor, Priyanka Chopra, Deb Mukherjee, Shivkumar Subramaniam, Chandan Roy Sanyal, Hrishikesh Joshi, Amole Gupte, Patricia Bull, Carlos Paca, Eric Santos",India,"October 1, 2018",2009,TV-14,128 min,"Dramas, International Movies, Music & Musicals","A young man pursues his dreams of wealth by breaking the law, while his twin brother tries to better his life through hard work and honesty."
s3820,Movie,Jonaki,Aditya Vikram Sengupta,"Lolita Chatterjee, Sumanto Chattopadhyay, Ratnabali Bhattacharjee, Jim Sarbh, Indrajit Sinha, Sandershika Tamang, Arunima Sinha, Satya Priya Chakraborty, Christel Das, Burjor Patel",India,"May 16, 2019",2018,TV-MA,96 min,"Dramas, Independent Movies, International Movies","In this quiet, wistful drama, a woman on her deathbed searches her fraying memories for love and fulfillment through surreal, meditative tableaux."
s5372,Movie,Aditi Mittal: Things They Wouldn't Let Me Say,Fazila Allana,Aditi Mittal,India,"July 18, 2017",2017,TV-MA,63 min,Stand-Up Comedy,"Trailblazing comic Aditi Mittal mixes topical stand-up with frank talk about being single, wearing thongs and the awkwardness of Indian movie ratings."
